ffff8800d51810c0 4103895166 S Co:6:013:0 s 00 09 0003 0000 0000 0
ffff8800d51810c0 4103897417 C Co:6:013:0 0 0
ffff8800a2117540 4103897472 S Ci:6:013:0 s 80 06 0304 0409 00ff 255 <
ffff8800a2117540 4103900413 C Ci:6:013:0 0 16 = 10034400 65006600 61007500 6c007400
ffff8800a2e44300 4103900474 S Ci:6:013:0 s 80 06 0305 0409 00ff 255 <
ffff8800a2e44300 4103902427 C Ci:6:013:0 0 12 = 0c034600 6c006100 73006800
ffff8800a2e440c0 4103902551 S Ii:6:013:2 -115:2 10 <
ffff8800a2e440c0 4103904416 C Ii:6:013:2 0:2 10 = 93020203 04050607 0809
ffff8800c9e6b0c0 4103905035 S Ii:6:013:2 -115:2 10 <
ffff8800c9e6b0c0 4103910412 C Ii:6:013:2 0:2 10 = 93030203 04050607 0809
ffff8800a2e44480 4103910433 S Ii:6:013:2 -115:2 10 <
ffff8800a2e44480 4103914427 C Ii:6:013:2 0:2 10 = 93040203 04050607 0809
ffff8800c9e6b600 4103915268 S Ii:6:013:2 -115:2 10 <
ffff8800c9e6b600 4103920613 C Ii:6:013:2 0:2 10 = 93050203 04050607 0809
ffff8800a2e446c0 4103920974 S Ii:6:013:2 -115:2 10 <
ffff8800a2e446c0 4103926420 C Ii:6:013:2 0:2 10 = 93060203 04050607 0809
ffff8800c9e6be40 4103926952 S Ii:6:013:2 -115:2 10 <
ffff8800c9e6be40 4103932449 C Ii:6:013:2 0:2 10 = 93070203 04050607 0809
ffff8800a2e44d80 4103933030 S Ii:6:013:2 -115:2 10 <
ffff8800a2e44d80 4103935434 C Ii:6:013:2 0:2 10 = 93080203 04050607 0809
ffff8800a2e44d80 4103935471 S Ii:6:013:2 -115:2 10 <
ffff8800a2e44d80 4103942419 C Ii:6:013:2 0:2 10 = 93090203 04050607 0809
ffff8800a2e44d80 4103943082 S Ii:6:013:2 -115:2 10 <
ffff8800a2e44d80 4103948435 C Ii:6:013:2 0:2 10 = 930a0203 04050607 0809
ffff8800a2e44d80 4103948582 S Ii:6:013:2 -115:2 10 <
ffff8800a2e44d80 4103952416 C Ii:6:013:2 0:2 10 = 930b0203 04050607 0809
ffff8800a2e44d80 4103952973 S Ii:6:013:2 -115:2 10 <
ffff8800a2e44d80 4103958432 C Ii:6:013:2 0:2 10 = 930c0203 04050607 0809
ffff8800a2e44d80 4103958457 S Ii:6:013:2 -115:2 10 <
ffff8800a2e44d80 4103964434 C Ii:6:013:2 0:2 10 = 930d0203 04050607 0809
ffff8800a2e44d80 4103965050 S Ii:6:013:2 -115:2 10 <
ffff8800a2e44d80 4103970416 C Ii:6:013:2 0:2 10 = 930e0203 04050607 0809
ffff8800a2e44d80 4103970608 S Ii:6:013:2 -115:2 10 <
ffff8800a2e44d80 4103974418 C Ii:6:013:2 0:2 10 = 930f0203 04050607 0809
ffff8800a2e44d80 4103975017 S Ii:6:013:2 -115:2 10 <
ffff8800a2e44d80 4103980416 C Ii:6:013:2 0:2 10 = 93100203 04050607 0809
ffff8800a2e44d80 4103980473 S Ii:6:013:2 -115:2 10 <
ffff8800a2e44d80 4103986416 C Ii:6:013:2 0:2 10 = 93110203 04050607 0809
ffff8800a2e44d80 4103987032 S Ii:6:013:2 -115:2 10 <
ffff8800a2e44d80 4103992616 C Ii:6:013:2 0:2 10 = 93120203 04050607 0809
ffff8800a2e44d80 4103993377 S Ii:6:013:2 -115:2 10 <
ffff8800a2e44d80 4103995615 C Ii:6:013:2 0:2 10 = 93130203 04050607 0809
ffff8800a2e44d80 4103995765 S Ii:6:013:2 -115:2 10 <
ffff8800a2e44d80 4104002616 C Ii:6:013:2 0:2 10 = 93140203 04050607 0809
ffff8800a2e44d80 4104003599 S Ii:6:013:2 -115:2 10 <
ffff8800a2e44d80 4104008429 C Ii:6:013:2 0:2 10 = 93150203 04050607 0809
ffff8800a2e44d80 4104008536 S Ii:6:013:2 -115:2 10 <
ffff8800a2e44d80 4104014417 C Ii:6:013:2 0:2 10 = 93160203 04050607 0809
ffff8800a2e44d80 4104015180 S Ii:6:013:2 -115:2 10 <
ffff8800a2e44d80 4104017432 C Ii:6:013:2 0:2 10 = 93170203 04050607 0809
ffff8800a2e44d80 4104018456 S Ii:6:013:2 -115:2 10 <
ffff8800a2e44d80 4104024433 C Ii:6:013:2 0:2 10 = 93180203 04050607 0809
ffff8800a2e44d80 4104025061 S Ii:6:013:2 -115:2 10 <
ffff8800a2e44d80 4104030433 C Ii:6:013:2 0:2 10 = 93190203 04050607 0809
ffff8800a2e44d80 4104030578 S Ii:6:013:2 -115:2 10 <
ffff8800a2e44d80 4104034419 C Ii:6:013:2 0:2 10 = 931a0203 04050607 0809
ffff8800a2e44d80 4104034990 S Ii:6:013:2 -115:2 10 <
ffff8800a2e44d80 4104040432 C Ii:6:013:2 0:2 10 = 931b0203 04050607 0809
ffff8800a2e44d80 4104040501 S Ii:6:013:2 -115:2 10 <
ffff8800a2e44d80 4104046416 C Ii:6:013:2 0:2 10 = 931c0203 04050607 0809
ffff8800a2e44d80 4104047147 S Ii:6:013:2 -115:2 10 <
ffff8800a2e44d80 4104052416 C Ii:6:013:2 0:2 10 = 931d0203 04050607 0809
ffff8800a2e44d80 4104052646 S Ii:6:013:2 -115:2 10 <
ffff8800a2e44d80 4104056416 C Ii:6:013:2 0:2 10 = 931e0203 04050607 0809
ffff8800a2e44d80 4104057093 S Ii:6:013:2 -115:2 10 <
ffff8800a2e44d80 4104062433 C Ii:6:013:2 0:2 10 = 931f0203 04050607 0809
ffff8800a2e44d80 4104062583 S Ii:6:013:2 -115:2 10 <
ffff8800a2e44d80 4104068432 C Ii:6:013:2 0:2 10 = 93200203 04050607 0809
ffff8800a2e44d80 4104069194 S Ii:6:013:2 -115:2 10 <
ffff8800a2e44d80 4104074419 C Ii:6:013:2 0:2 10 = 93210203 04050607 0809
ffff8800a2e44d80 4104074691 S Ii:6:013:2 -115:2 10 <
ffff8800a2e44d80 4104078416 C Ii:6:013:2 0:2 10 = 93220203 04050607 0809
ffff8800a2e44d80 4104079141 S Ii:6:013:2 -115:2 10 <
ffff8800a2e44d80 4104084419 C Ii:6:013:2 0:2 10 = 93230203 04050607 0809
ffff8800a2e44d80 4104084622 S Ii:6:013:2 -115:2 10 <
ffff8800a2e44d80 4104090416 C Ii:6:013:2 0:2 10 = 93240203 04050607 0809
ffff8800a2e44d80 4104091248 S Ii:6:013:2 -115:2 10 <
ffff8800a2e44d80 4104094434 C Ii:6:013:2 0:2 10 = 93250203 04050607 0809
ffff8800a2e44d80 4104094586 S Ii:6:013:2 -115:2 10 <
ffff8800a2e44d80 4104100416 C Ii:6:013:2 0:2 10 = 93260203 04050607 0809
ffff8800a2e44d80 4104101229 S Ii:6:013:2 -115:2 10 <
ffff8800a2e44d80 4104106432 C Ii:6:013:2 0:2 10 = 93270203 04050607 0809
ffff8800a2e44d80 4104106726 S Ii:6:013:2 -115:2 10 <
ffff8800a2e44d80 4104112432 C Ii:6:013:2 0:2 10 = 93280203 04050607 0809
ffff8800a2e44d80 4104113236 S Ii:6:013:2 -115:2 10 <
ffff8800a2e44d80 4104115437 C Ii:6:013:2 0:2 10 = 93290203 04050607 0809
ffff8800a2e44d80 4104115454 S Ii:6:013:2 -115:2 10 <
ffff8800a2e44d80 4104122416 C Ii:6:013:2 0:2 10 = 932a0203 04050607 0809
ffff8800a2e44d80 4104123129 S Ii:6:013:2 -115:2 10 <
ffff8800a2e44d80 4104128417 C Ii:6:013:2 0:2 10 = 932b0203 04050607 0809
ffff8800a2e44d80 4104128615 S Ii:6:013:2 -115:2 10 <
ffff8800a2e44d80 4104134435 C Ii:6:013:2 0:2 10 = 932c0203 04050607 0809
ffff8800a2e44d80 4104135137 S Ii:6:013:2 -115:2 10 <
ffff8800a2e44d80 4104137433 C Ii:6:013:2 0:2 10 = 932d0203 04050607 0809
ffff8800a2e44d80 4104138440 S Ii:6:013:2 -115:2 10 <
ffff8800a2e44d80 4104144418 C Ii:6:013:2 0:2 10 = 932e0203 04050607 0809
ffff8800a2e44d80 4104145061 S Ii:6:013:2 -115:2 10 <
ffff8800a2e44d80 4104150416 C Ii:6:013:2 0:2 10 = 932f0203 04050607 0809
ffff8800a2e44d80 4104150557 S Ii:6:013:2 -115:2 10 <
ffff8800a2e44d80 4104154419 C Ii:6:013:2 0:2 10 = 93300203 04050607 0809
ffff8800a2e44d80 4104154965 S Ii:6:013:2 -115:2 10 <
ffff8800a2e44d80 4104160417 C Ii:6:013:2 0:2 10 = 93310203 04050607 0809
ffff8800a2e44d80 4104160487 S Ii:6:013:2 -115:2 10 <
ffff8800a2e44d80 4104166432 C Ii:6:013:2 0:2 10 = 93320203 04050607 0809
ffff8800a2e44d80 4104167058 S Ii:6:013:2 -115:2 10 <
ffff8800a2e44d80 4104172432 C Ii:6:013:2 0:2 10 = 93330203 04050607 0809
ffff8800a2e44d80 4104172541 S Ii:6:013:2 -115:2 10 <
ffff8800a2e44d80 4104176417 C Ii:6:013:2 0:2 10 = 93340203 04050607 0809
ffff8800a2e44d80 4104176992 S Ii:6:013:2 -115:2 10 <
ffff8800a2e44d80 4104182411 C Ii:6:013:2 0:2 10 = 93350203 04050607 0809
ffff8800a2e44d80 4104182488 S Ii:6:013:2 -115:2 10 <
ffff8800a2e44d80 4104188432 C Ii:6:013:2 0:2 10 = 93360203 04050607 0809
ffff8800a2e44d80 4104189123 S Ii:6:013:2 -115:2 10 <
ffff8800a2e44d80 4104194434 C Ii:6:013:2 0:2 10 = 93370203 04050607 0809
ffff8800a2e44d80 4104194641 S Ii:6:013:2 -115:2 10 <
ffff8800a2e44d80 4104198416 C Ii:6:013:2 0:2 10 = 93380203 04050607 0809
ffff8800a2e44d80 4104199090 S Ii:6:013:2 -115:2 10 <
ffff8800a2e44d80 4104204433 C Ii:6:013:2 0:2 10 = 93390203 04050607 0809
ffff8800a2e44d80 4104204671 S Ii:6:013:2 -115:2 10 <
ffff8800a2e44d80 4104210433 C Ii:6:013:2 0:2 10 = 933a0203 04050607 0809
ffff8800a2e44d80 4104211263 S Ii:6:013:2 -115:2 10 <
ffff8800a2e44d80 4104216432 C Ii:6:013:2 0:2 10 = 933b0203 04050607 0809
ffff8800a2e44d80 4104216756 S Ii:6:013:2 -115:2 10 <
ffff8800a2e44d80 4104220432 C Ii:6:013:2 0:2 10 = 933c0203 04050607 0809
ffff8800a2e44d80 4104221191 S Ii:6:013:2 -115:2 10 <
ffff8800a2e44d80 4104226432 C Ii:6:013:2 0:2 10 = 933d0203 04050607 0809
ffff8800a2e44d80 4104226719 S Ii:6:013:2 -115:2 10 <
ffff8800a2e44d80 4104232411 C Ii:6:013:2 0:2 10 = 933e0203 04050607 0809
ffff8800a2e44d80 4104233333 S Ii:6:013:2 -115:2 10 <
ffff8800a2e44d80 4104236415 C Ii:6:013:2 0:2 10 = 933f0203 04050607 0809
ffff8800a2e44d80 4104236750 S Ii:6:013:2 -115:2 10 <
ffff8800a2e44d80 4104242613 C Ii:6:013:2 0:2 10 = 93400203 04050607 0809
ffff8800a2e44d80 4104242928 S Ii:6:013:2 -115:2 10 <
ffff8800a2e44d80 4104248616 C Ii:6:013:2 0:2 10 = 93410203 04050607 0809
ffff8800a2e44d80 4104249476 S Ii:6:013:2 -115:2 10 <
ffff8800a2e44d80 4104254452 C Ii:6:013:2 0:2 10 = 93420203 04050607 0809
ffff8800a2e44d80 4104255546 S Ii:6:013:2 -115:2 10 <
ffff8800a2e44d80 4104257451 C Ii:6:013:2 0:2 10 = 93430203 04050607 0809
ffff8800a2e44d80 4104257789 S Ii:6:013:2 -115:2 10 <
ffff8800a2e44d80 4104264436 C Ii:6:013:2 0:2 10 = 93440203 04050607 0809
ffff8800a2e44d80 4104265473 S Ii:6:013:2 -115:2 10 <
ffff8800a2e44d80 4104270438 C Ii:6:013:2 0:2 10 = 93450203 04050607 0809
ffff8800a2e44d80 4104270954 S Ii:6:013:2 -115:2 10 <
ffff8800a2e44d80 4104276432 C Ii:6:013:2 0:2 10 = 93460203 04050607 0809
ffff8800a2e44d80 4104276475 S Ii:6:013:2 -115:2 10 <
ffff8800a2e44d80 4104280432 C Ii:6:013:2 0:2 10 = 93470203 04050607 0809
ffff8800a2e44d80 4104280905 S Ii:6:013:2 -115:2 10 <
ffff8800a2e44d80 4104286410 C Ii:6:013:2 0:2 10 = 93480203 04050607 0809
ffff8800a2e44d80 4104286428 S Ii:6:013:2 -115:2 10 <
ffff8800a2e44d80 4104292432 C Ii:6:013:2 0:2 10 = 93490203 04050607 0809
ffff8800a2e44d80 4104292991 S Ii:6:013:2 -115:2 10 <
ffff8800a2e44d80 4104296417 C Ii:6:013:2 0:2 10 = 934a0203 04050607 0809
ffff8800a2e44d80 4104297441 S Ii:6:013:2 -115:2 10 <
ffff8800a2e44d80 4104302416 C Ii:6:013:2 0:2 10 = 934b0203 04050607 0809
ffff8800a2e44d80 4104302975 S Ii:6:013:2 -115:2 10 <
ffff8800a2e44d80 4104308432 C Ii:6:013:2 0:2 10 = 934c0203 04050607 0809
ffff8800a2e44d80 4104308500 S Ii:6:013:2 -115:2 10 <
ffff8800a2e44d80 4104314434 C Ii:6:013:2 0:2 10 = 934d0203 04050607 0809
ffff8800a2e44d80 4104315058 S Ii:6:013:2 -115:2 10 <
ffff8800a2e44d80 4104318412 C Ii:6:013:2 0:2 10 = 934e0203 04050607 0809
ffff8800a2e44d80 4104319507 S Ii:6:013:2 -115:2 10 <
ffff8800a2e44d80 4104324434 C Ii:6:013:2 0:2 10 = 934f0203 04050607 0809
ffff8800a2e44d80 4104324992 S Ii:6:013:2 -115:2 10 <
ffff8800a2e44d80 4104330433 C Ii:6:013:2 0:2 10 = 93500203 04050607 0809
ffff8800a2e44d80 4104330499 S Ii:6:013:2 -115:2 10 <
ffff8800a2e44d80 4104336417 C Ii:6:013:2 0:2 10 = 93510203 04050607 0809
ffff8800a2e44d80 4104337108 S Ii:6:013:2 -115:2 10 <
ffff8800a2e44d80 4104340421 C Ii:6:013:2 0:2 10 = 93520203 04050607 0809
ffff8800a2e44d80 4104340478 S Ii:6:013:2 -115:2 10 <
ffff8800a2e44d80 4104346416 C Ii:6:013:2 0:2 10 = 93530203 04050607 0809
ffff8800a2e44d80 4104347124 S Ii:6:013:2 -115:2 10 <
ffff8800a2e44d80 4104352416 C Ii:6:013:2 0:2 10 = 93540203 04050607 0809
ffff8800a2e44d80 4104352620 S Ii:6:013:2 -115:2 10 <
ffff8800a2e44d80 4104358417 C Ii:6:013:2 0:2 10 = 93550203 04050607 0809
ffff8800a2e44d80 4104359182 S Ii:6:013:2 -115:2 10 <
ffff8800a2e44d80 4104362434 C Ii:6:013:2 0:2 10 = 93560203 04050607 0809
ffff8800a2e44d80 4104362503 S Ii:6:013:2 -115:2 10 <
ffff8800a2e44d80 4104368416 C Ii:6:013:2 0:2 10 = 93570203 04050607 0809
ffff8800a2e44d80 4104369147 S Ii:6:013:2 -115:2 10 <
ffff8800a2e44d80 4104374419 C Ii:6:013:2 0:2 10 = 93580203 04050607 0809
ffff8800a2e44d80 4104374691 S Ii:6:013:2 -115:2 10 <
ffff8800a2e44d80 4104377432 C Ii:6:013:2 0:2 10 = 93590203 04050607 0809
ffff8800a2e44d80 4104377975 S Ii:6:013:2 -115:2 10 <
ffff8800a2e44d80 4104384435 C Ii:6:013:2 0:2 10 = 935a0203 04050607 0809
ffff8800a2e44d80 4104384702 S Ii:6:013:2 -115:2 10 <
ffff8800a2e44d80 4104390433 C Ii:6:013:2 0:2 10 = 935b0203 04050607 0809
ffff8800a2e44d80 4104391308 S Ii:6:013:2 -115:2 10 <
ffff8800a2e44d80 4104396419 C Ii:6:013:2 0:2 10 = 935c0203 04050607 0809
ffff8800a2e44d80 4104397222 S Ii:6:013:2 -115:2 10 <
ffff8800a2e44d80 4104400436 C Ii:6:013:2 0:2 10 = 935d0203 04050607 0809
ffff8800c9e6b540 4104400511 S Ii:6:013:2 -115:2 10 <
ffff8800c9e6b540 4104406426 C Ii:6:013:2 0:2 10 = 935e0203 04050607 0809
ffff8800a2213f00 4104406997 S Ii:6:013:2 -115:2 10 <
ffff8800a2213f00 4104412420 C Ii:6:013:2 0:2 10 = 935f0203 04050607 0809
ffff88011ebfbe40 4104413498 S Ii:6:013:2 -115:2 10 <
ffff88011ebfbe40 4104418416 C Ii:6:013:2 0:2 10 = 93600203 04050607 0809
ffff88011ebfbe40 4104418986 S Ii:6:013:2 -115:2 10 <
ffff88011ebfbe40 4104422432 C Ii:6:013:2 0:2 10 = 93610203 04050607 0809
ffff88011ebfbe40 4104423393 S Ii:6:013:2 -115:2 10 <
ffff88011ebfbe40 4104428416 C Ii:6:013:2 0:2 10 = 93620203 04050607 0809
ffff88011ebfbe40 4104428881 S Ii:6:013:2 -115:2 10 <
ffff88011ebfbe40 4104434434 C Ii:6:013:2 0:2 10 = 93630203 04050607 0809
ffff88011ebfbe40 4104435461 S Ii:6:013:2 -115:2 10 <
ffff88011ebfbe40 4104437431 C Ii:6:013:2 0:2 10 = 93640203 04050607 0809
ffff88011ebfbe40 4104437645 S Ii:6:013:2 -115:2 10 <
ffff88011ebfbe40 4104444418 C Ii:6:013:2 0:2 10 = 93650203 04050607 0809
ffff88011ebfbe40 4104445372 S Ii:6:013:2 -115:2 10 <
ffff88011ebfbe40 4104450416 C Ii:6:013:2 0:2 10 = 93660203 04050607 0809
ffff88011ebfbe40 4104450913 S Ii:6:013:2 -115:2 10 <
ffff88011ebfbe40 4104456417 C Ii:6:013:2 0:2 10 = 93670203 04050607 0809
ffff88011ebfbe40 4104457451 S Ii:6:013:2 -115:2 10 <
ffff88011ebfbe40 4104460416 C Ii:6:013:2 0:2 10 = 93680203 04050607 0809
ffff88011ebfbe40 4104460759 S Ii:6:013:2 -115:2 10 <
ffff88011ebfbe40 4104466412 C Ii:6:013:2 0:2 10 = 93690203 04050607 0809
ffff8800c62e8900 4104467300 S Ii:6:013:2 -115:2 10 <
ffff8800c62e8900 4104472412 C Ii:6:013:2 0:2 10 = 936a0203 04050607 0809
ffff880109bfcb40 4104472739 S Ii:6:013:2 -115:2 10 <
ffff880109bfcb40 4104478412 C Ii:6:013:2 0:2 10 = 936b0203 04050607 0809
ffff880109bfcb40 4104479393 S Ii:6:013:2 -115:2 10 <
ffff880109bfcb40 4104482412 C Ii:6:013:2 0:2 10 = 936c0203 04050607 0809
ffff880109bfcb40 4104483204 S Ii:6:013:2 -115:2 10 <
ffff880109bfcb40 4104487762 C Ii:6:013:2 0:2 10 = 936d0203 04050607 0809
ffff880109bfcb40 4104488597 S Ii:6:013:2 -115:2 10 <
ffff880109bfcb40 4104494425 C Ii:6:013:2 0:2 10 = 936e0203 04050607 0809
ffff88011d388900 4104496290 S Ii:6:013:2 -115:2 10 <
ffff88011d388900 4104498420 C Ii:6:013:2 0:2 10 = 936f0203 04050607 0809
ffff88011d388900 4104498483 S Ii:6:013:2 -115:2 10 <
ffff88011d388900 4104504427 C Ii:6:013:2 0:2 10 = 93700203 04050607 0809
ffff88011d388900 4104505316 S Ii:6:013:2 -115:2 10 <
ffff88011d388900 4104510437 C Ii:6:013:2 0:2 10 = 93710203 04050607 0809
ffff8800d5261c00 4104511485 S Ii:6:013:2 -115:2 10 <
ffff8800d5261c00 4104516432 C Ii:6:013:2 0:2 10 = 93720203 04050607 0809
ffff8800d5261c00 4104516962 S Ii:6:013:2 -115:2 10 <
ffff8800d5261c00 4104520416 C Ii:6:013:2 0:2 10 = 93730203 04050607 0809
ffff8800d5261c00 4104521411 S Ii:6:013:2 -115:2 10 <
ffff8800d5261c00 4104526434 C Ii:6:013:2 0:2 10 = 93740203 04050607 0809
ffff8800d5261c00 4104526880 S Ii:6:013:2 -115:2 10 <
ffff8800d5261c00 4104532409 C Ii:6:013:2 0:2 10 = 93750203 04050607 0809
ffff8800d5261c00 4104533186 S Ii:6:013:2 -115:2 10 <
ffff8800d5261c00 4104538416 C Ii:6:013:2 0:2 10 = 93760203 04050607 0809
ffff8800d5261c00 4104538737 S Ii:6:013:2 -115:2 10 <
ffff8800d5261c00 4104541435 C Ii:6:013:2 0:2 10 = 93770203 04050607 0809
ffff8800d5261c00 4104542019 S Ii:6:013:2 -115:2 10 <
ffff8800d5261c00 4104548418 C Ii:6:013:2 0:2 10 = 93780203 04050607 0809
ffff8800d5261c00 4104548620 S Ii:6:013:2 -115:2 10 <
ffff8800d5261c00 4104554434 C Ii:6:013:2 0:2 10 = 93790203 04050607 0809
ffff8800d5261c00 4104555197 S Ii:6:013:2 -115:2 10 <
ffff8800d5261c00 4104560432 C Ii:6:013:2 0:2 10 = 937a0203 04050607 0809
ffff8800d5261c00 4104561064 S Ii:6:013:2 -115:2 10 <
ffff8800d5261c00 4104563433 C Ii:6:013:2 0:2 10 = 937b0203 04050607 0809
ffff8800d5261c00 4104564363 S Ii:6:013:2 -115:2 10 <
ffff8800d5261c00 4104570416 C Ii:6:013:2 0:2 10 = 937c0203 04050607 0809
ffff8800d5261c00 4104570953 S Ii:6:013:2 -115:2 10 <
ffff8800d5261c00 4104576433 C Ii:6:013:2 0:2 10 = 937d0203 04050607 0809
ffff8800d5261c00 4104576502 S Ii:6:013:2 -115:2 10 <
ffff8800d5261c00 4104579432 C Ii:6:013:2 0:2 10 = 937e0203 04050607 0809
ffff8800d5261c00 4104579787 S Ii:6:013:2 -115:2 10 <
ffff8800d5261c00 4104586432 C Ii:6:013:2 0:2 10 = 937f0203 04050607 0809
ffff8800d5261c00 4104587439 S Ii:6:013:2 -115:2 10 <
ffff8800d5261c00 4104592432 C Ii:6:013:2 0:2 10 = 93800203 04050607 0809
ffff8800d5261c00 4104592922 S Ii:6:013:2 -115:2 10 <
ffff8800d5261c00 4104598425 C Ii:6:013:2 0:2 10 = 93810203 04050607 0809
ffff8800d5261c00 4104598474 S Ii:6:013:2 -115:2 10 <
ffff8800d5261c00 4104602416 C Ii:6:013:2 0:2 10 = 93820203 04050607 0809
ffff8800d5261c00 4104602922 S Ii:6:013:2 -115:2 10 <
ffff8800d5261c00 4104608410 C Ii:6:013:2 0:2 10 = 93830203 04050607 0809
ffff8800d5261c00 4104609517 S Ii:6:013:2 -115:2 10 <
ffff8800d5261c00 4104614434 C Ii:6:013:2 0:2 10 = 93840203 04050607 0809
ffff8800d5261c00 4104614991 S Ii:6:013:2 -115:2 10 <
ffff8800d5261c00 4104620432 C Ii:6:013:2 0:2 10 = 93850203 04050607 0809
ffff8800d5261c00 4104620499 S Ii:6:013:2 -115:2 10 <
ffff8800d5261c00 4104623432 C Ii:6:013:2 0:2 10 = 93860203 04050607 0809
ffff8800d5261c00 4104623907 S Ii:6:013:2 -115:2 10 <
ffff8800d5261c00 4104630417 C Ii:6:013:2 0:2 10 = 93870203 04050607 0809
ffff8800d5261c00 4104630472 S Ii:6:013:2 -115:2 10 <
ffff8800d5261c00 4104636432 C Ii:6:013:2 0:2 10 = 93880203 04050607 0809
ffff8800d5261c00 4104637022 S Ii:6:013:2 -115:2 10 <
ffff8800d5261c00 4104639432 C Ii:6:013:2 0:2 10 = 93890203 04050607 0809
ffff8800d5261c00 4104640329 S Ii:6:013:2 -115:2 10 <
ffff8800d5261c00 4104646416 C Ii:6:013:2 0:2 10 = 938a0203 04050607 0809
ffff8800d5261c00 4104646935 S Ii:6:013:2 -115:2 10 <
ffff8800d5261c00 4104652433 C Ii:6:013:2 0:2 10 = 938b0203 04050607 0809
ffff8800d5261c00 4104653498 S Ii:6:013:2 -115:2 10 <
ffff8800d5261c00 4104658417 C Ii:6:013:2 0:2 10 = 938c0203 04050607 0809
ffff8800d5261c00 4104658951 S Ii:6:013:2 -115:2 10 <
ffff8800d5261c00 4104662416 C Ii:6:013:2 0:2 10 = 938d0203 04050607 0809
ffff8800d5261c00 4104663401 S Ii:6:013:2 -115:2 10 <
ffff8800d5261c00 4104668416 C Ii:6:013:2 0:2 10 = 938e0203 04050607 0809
ffff8800d5261c00 4104668937 S Ii:6:013:2 -115:2 10 <
ffff8800d5261c00 4104674429 C Ii:6:013:2 0:2 10 = 938f0203 04050607 0809
ffff8800d5261c00 4104674480 S Ii:6:013:2 -115:2 10 <
ffff8800d5261c00 4104680433 C Ii:6:013:2 0:2 10 = 93900203 04050607 0809
ffff8800d5261c00 4104681094 S Ii:6:013:2 -115:2 10 <
ffff8800d5261c00 4104684422 C Ii:6:013:2 0:2 10 = 93910203 04050607 0809
ffff8800d5261c00 4104685513 S Ii:6:013:2 -115:2 10 <
ffff8800d5261c00 4104690432 C Ii:6:013:2 0:2 10 = 93920203 04050607 0809
ffff8800d5261c00 4104690965 S Ii:6:013:2 -115:2 10 <
ffff8800d5261c00 4104696432 C Ii:6:013:2 0:2 10 = 93930203 04050607 0809
ffff8800d5261c00 4104696505 S Ii:6:013:2 -115:2 10 <
ffff8800d5261c00 4104702416 C Ii:6:013:2 0:2 10 = 93940203 04050607 0809
ffff8800d5261c00 4104703149 S Ii:6:013:2 -115:2 10 <
ffff8800d5261c00 4104706433 C Ii:6:013:2 0:2 10 = 93950203 04050607 0809
ffff8800d5261c00 4104706496 S Ii:6:013:2 -115:2 10 <
ffff8800d5261c00 4104712432 C Ii:6:013:2 0:2 10 = 93960203 04050607 0809
ffff8800d5261c00 4104713044 S Ii:6:013:2 -115:2 10 <
ffff8800d5261c00 4104718434 C Ii:6:013:2 0:2 10 = 93970203 04050607 0809
ffff8800d5261c00 4104718559 S Ii:6:013:2 -115:2 10 <
ffff8800d5261c00 4104722433 C Ii:6:013:2 0:2 10 = 93980203 04050607 0809
ffff8800d5261c00 4104722988 S Ii:6:013:2 -115:2 10 <
ffff8800d5261c00 4104728435 C Ii:6:013:2 0:2 10 = 93990203 04050607 0809
ffff8800d5261c00 4104728502 S Ii:6:013:2 -115:2 10 <
ffff8800d5261c00 4104734419 C Ii:6:013:2 0:2 10 = 939a0203 04050607 0809
ffff8800d5261c00 4104735124 S Ii:6:013:2 -115:2 10 <
ffff8800d5261c00 4104740443 C Ii:6:013:2 0:2 10 = 939b0203 04050607 0809
ffff8800d5261c00 4104740686 S Ii:6:013:2 -115:2 10 <
ffff8800d5261c00 4104743616 C Ii:6:013:2 0:2 10 = 939c0203 04050607 0809
ffff8800d5261c00 4104744452 S Ii:6:013:2 -115:2 10 <
ffff8800d5261c00 4104750433 C Ii:6:013:2 0:2 10 = 939d0203 04050607 0809
ffff8800d5261c00 4104751050 S Ii:6:013:2 -115:2 10 <
ffff8800d5261c00 4104756432 C Ii:6:013:2 0:2 10 = 939e0203 04050607 0809
ffff8800d5261c00 4104756678 S Ii:6:013:2 -115:2 10 <
ffff8800d5261c00 4104762614 C Ii:6:013:2 0:2 10 = 939f0203 04050607 0809
ffff8800a2139840 4104763480 S Ii:6:013:2 -115:2 10 <
ffff8800a2139840 4104765457 C Ii:6:013:2 0:2 10 = 93a00203 04050607 0809
ffff8800a2139840 4104765796 S Ii:6:013:2 -115:2 10 <
ffff8800a2139840 4104772442 C Ii:6:013:2 0:2 10 = 93a10203 04050607 0809
ffff8800a2139840 4104773404 S Ii:6:013:2 -115:2 10 <
ffff8800a2139840 4104778443 C Ii:6:013:2 0:2 10 = 93a20203 04050607 0809
ffff8800a2139840 4104779194 S Ii:6:013:2 -115:2 10 <
ffff8800a2139840 4104781622 C Ii:6:013:2 0:2 10 = 93a30203 04050607 0809
ffff8800a2139840 4104781670 S Ii:6:013:2 -115:2 10 <
ffff8800a2139840 4104788444 C Ii:6:013:2 0:2 10 = 93a40203 04050607 0809
ffff8800a2139840 4104788945 S Ii:6:013:2 -115:2 10 <
ffff8800a2139840 4104794641 C Ii:6:013:2 0:2 10 = 93a50203 04050607 0809
ffff8800a2139840 4104794840 S Ii:6:013:2 -115:2 10 <
ffff8800a2139840 4104800616 C Ii:6:013:2 0:2 10 = 93a60203 04050607 0809
ffff8800a2139840 4104801414 S Ii:6:013:2 -115:2 10 <
ffff8800a2139840 4104803613 C Ii:6:013:2 0:2 10 = 93a70203 04050607 0809
ffff8800a2139840 4104803760 S Ii:6:013:2 -115:2 10 <
ffff8800a2139840 4104810619 C Ii:6:013:2 0:2 10 = 93a80203 04050607 0809
ffff8800a2139840 4104811442 S Ii:6:013:2 -115:2 10 <
ffff8800a2139840 4104816522 C Ii:6:013:2 0:2 10 = 93a90203 04050607 0809
ffff8800a2139840 4104816572 S Ii:6:013:2 -115:2 10 <
ffff8800a2139840 4104822443 C Ii:6:013:2 0:2 10 = 93aa0203 04050607 0809
ffff8800a2139840 4104823409 S Ii:6:013:2 -115:2 10 <
ffff8800a2139840 4104826416 C Ii:6:013:2 0:2 10 = 93ab0203 04050607 0809
ffff8800a2139840 4104826749 S Ii:6:013:2 -115:2 10 <
ffff8800a2139840 4104832434 C Ii:6:013:2 0:2 10 = 93ac0203 04050607 0809
ffff8800a2139840 4104833313 S Ii:6:013:2 -115:2 10 <
ffff8800a2139840 4104838435 C Ii:6:013:2 0:2 10 = 93ad0203 04050607 0809
ffff8800a2139840 4104838814 S Ii:6:013:2 -115:2 10 <
ffff8800a2139840 4104841434 C Ii:6:013:2 0:2 10 = 93ae0203 04050607 0809
ffff8800a2139840 4104842095 S Ii:6:013:2 -115:2 10 <
ffff8800a2139840 4104848418 C Ii:6:013:2 0:2 10 = 93af0203 04050607 0809
ffff8800a2139840 4104848693 S Ii:6:013:2 -115:2 10 <
ffff8800a2139840 4104854434 C Ii:6:013:2 0:2 10 = 93b00203 04050607 0809
ffff8800a2139840 4104855250 S Ii:6:013:2 -115:2 10 <
ffff8800a2139840 4104860432 C Ii:6:013:2 0:2 10 = 93b10203 04050607 0809
ffff8800a2139840 4104860688 S Ii:6:013:2 -115:2 10 <
ffff8800a2139840 4104864419 C Ii:6:013:2 0:2 10 = 93b20203 04050607 0809
ffff8800a2139840 4104865138 S Ii:6:013:2 -115:2 10 <
ffff8800a2139840 4104870417 C Ii:6:013:2 0:2 10 = 93b30203 04050607 0809
ffff8800a2139840 4104870634 S Ii:6:013:2 -115:2 10 <
ffff8800a2139840 4104876416 C Ii:6:013:2 0:2 10 = 93b40203 04050607 0809
ffff8800a2139840 4104877264 S Ii:6:013:2 -115:2 10 <
ffff8800a2139840 4104882433 C Ii:6:013:2 0:2 10 = 93b50203 04050607 0809
ffff8800a2139840 4104882721 S Ii:6:013:2 -115:2 10 <
ffff8800a2139840 4104886416 C Ii:6:013:2 0:2 10 = 93b60203 04050607 0809
ffff8800a2139840 4104887151 S Ii:6:013:2 -115:2 10 <
ffff8800a2139840 4104892432 C Ii:6:013:2 0:2 10 = 93b70203 04050607 0809
ffff8800a2139840 4104892689 S Ii:6:013:2 -115:2 10 <
ffff8800a2139840 4104898433 C Ii:6:013:2 0:2 10 = 93b80203 04050607 0809
ffff8800a2139840 4104899271 S Ii:6:013:2 -115:2 10 <
ffff8800a2139840 4104904434 C Ii:6:013:2 0:2 10 = 93b90203 04050607 0809
ffff8800a2139840 4104904758 S Ii:6:013:2 -115:2 10 <
ffff8800a2139840 4104908432 C Ii:6:013:2 0:2 10 = 93ba0203 04050607 0809
ffff8800a2139840 4104909146 S Ii:6:013:2 -115:2 10 <
ffff8800a2139840 4104914419 C Ii:6:013:2 0:2 10 = 93bb0203 04050607 0809
ffff8800a2139840 4104914644 S Ii:6:013:2 -115:2 10 <
ffff8800a2139840 4104920432 C Ii:6:013:2 0:2 10 = 93bc0203 04050607 0809
ffff8800a2139840 4104921211 S Ii:6:013:2 -115:2 10 <
ffff8800a2139840 4104924419 C Ii:6:013:2 0:2 10 = 93bd0203 04050607 0809
ffff8800a2139840 4104924532 S Ii:6:013:2 -115:2 10 <
ffff8800a2139840 4104930433 C Ii:6:013:2 0:2 10 = 93be0203 04050607 0809
ffff8800a2139840 4104931095 S Ii:6:013:2 -115:2 10 <
ffff8800a2139840 4104936433 C Ii:6:013:2 0:2 10 = 93bf0203 04050607 0809
ffff8800a2139840 4104936619 S Ii:6:013:2 -115:2 10 <
ffff8800a2139840 4104942433 C Ii:6:013:2 0:2 10 = 93c00203 04050607 0809
ffff8800a2139840 4104943240 S Ii:6:013:2 -115:2 10 <
ffff8800a2139840 4104945437 C Ii:6:013:2 0:2 10 = 93c10203 04050607 0809
ffff8800a2139840 4104945535 S Ii:6:013:2 -115:2 10 <
ffff8800a2139840 4104952433 C Ii:6:013:2 0:2 10 = 93c20203 04050607 0809
ffff8800a2139840 4104953207 S Ii:6:013:2 -115:2 10 <
ffff8800a2139840 4104958419 C Ii:6:013:2 0:2 10 = 93c30203 04050607 0809
ffff8800a2139840 4104958680 S Ii:6:013:2 -115:2 10 <
ffff8800a2139840 4104964418 C Ii:6:013:2 0:2 10 = 93c40203 04050607 0809
ffff8800a2139840 4104965322 S Ii:6:013:2 -115:2 10 <
ffff8800a2139840 4104968419 C Ii:6:013:2 0:2 10 = 93c50203 04050607 0809
ffff8800a2139840 4104968644 S Ii:6:013:2 -115:2 10 <
ffff8800a2139840 4104974418 C Ii:6:013:2 0:2 10 = 93c60203 04050607 0809
ffff8800a2139840 4104975220 S Ii:6:013:2 -115:2 10 <
ffff8800a2139840 4104980417 C Ii:6:013:2 0:2 10 = 93c70203 04050607 0809
ffff8800a2139840 4104980718 S Ii:6:013:2 -115:2 10 <
ffff8800a2139840 4104983433 C Ii:6:013:2 0:2 10 = 93c80203 04050607 0809
ffff8800a2139840 4104983985 S Ii:6:013:2 -115:2 10 <
ffff8800a2139840 4104990617 C Ii:6:013:2 0:2 10 = 93c90203 04050607 0809
ffff8800a2139840 4104990876 S Ii:6:013:2 -115:2 10 <
ffff8800a2139840 4104996614 C Ii:6:013:2 0:2 10 = 93ca0203 04050607 0809
ffff8800a2139840 4104997438 S Ii:6:013:2 -115:2 10 <
ffff8800a2139840 4105002526 C Ii:6:013:2 0:2 10 = 93cb0203 04050607 0809
ffff8800a2139840 4105002575 S Ii:6:013:2 -115:2 10 <
ffff8800a2139840 4105005613 C Ii:6:013:2 0:2 10 = 93cc0203 04050607 0809
ffff8800a2139840 4105006554 S Ii:6:013:2 -115:2 10 <
ffff8800a2139840 4105012438 C Ii:6:013:2 0:2 10 = 93cd0203 04050607 0809
ffff8800a2139840 4105013157 S Ii:6:013:2 -115:2 10 <
ffff8800a2139840 4105018435 C Ii:6:013:2 0:2 10 = 93ce0203 04050607 0809
ffff8800a2139840 4105018679 S Ii:6:013:2 -115:2 10 <
ffff8800a2139840 4105024434 C Ii:6:013:2 0:2 10 = 93cf0203 04050607 0809
ffff8800a2139840 4105025399 S Ii:6:013:2 -115:2 10 <
ffff8800a2139840 4105027433 C Ii:6:013:2 0:2 10 = 93d00203 04050607 0809
ffff8800a2139840 4105027597 S Ii:6:013:2 -115:2 10 <
ffff8800a2139840 4105034433 C Ii:6:013:2 0:2 10 = 93d10203 04050607 0809
ffff8800a2139840 4105035234 S Ii:6:013:2 -115:2 10 <
ffff8800a2139840 4105040417 C Ii:6:013:2 0:2 10 = 93d20203 04050607 0809
ffff8800a2139840 4105040754 S Ii:6:013:2 -115:2 10 <
ffff8800a2139840 4105046432 C Ii:6:013:2 0:2 10 = 93d30203 04050607 0809
ffff8800a2139840 4105047315 S Ii:6:013:2 -115:2 10 <
ffff8800a2139840 4105049433 C Ii:6:013:2 0:2 10 = 93d40203 04050607 0809
ffff8800a2139840 4105049539 S Ii:6:013:2 -115:2 10 <
ffff8800a2139840 4105056433 C Ii:6:013:2 0:2 10 = 93d50203 04050607 0809
ffff8800a2139840 4105057229 S Ii:6:013:2 -115:2 10 <
ffff8800a2139840 4105062432 C Ii:6:013:2 0:2 10 = 93d60203 04050607 0809
ffff8800a2139840 4105062733 S Ii:6:013:2 -115:2 10 <
ffff8800a2139840 4105066416 C Ii:6:013:2 0:2 10 = 93d70203 04050607 0809
ffff8800a2139840 4105067183 S Ii:6:013:2 -115:2 10 <
ffff8800a2139840 4105072417 C Ii:6:013:2 0:2 10 = 93d80203 04050607 0809
ffff8800a2139840 4105072682 S Ii:6:013:2 -115:2 10 <
ffff8800a2139840 4105078416 C Ii:6:013:2 0:2 10 = 93d90203 04050607 0809
ffff8800a2139840 4105079326 S Ii:6:013:2 -115:2 10 <
ffff8800a2139840 4105084419 C Ii:6:013:2 0:2 10 = 93da0203 04050607 0809
ffff8800a2139840 4105084850 S Ii:6:013:2 -115:2 10 <
ffff8800a2139840 4105087433 C Ii:6:013:2 0:2 10 = 93db0203 04050607 0809
ffff8800a2139840 4105088136 S Ii:6:013:2 -115:2 10 <
ffff8800a2139840 4105094418 C Ii:6:013:2 0:2 10 = 93dc0203 04050607 0809
ffff8800a2139840 4105094738 S Ii:6:013:2 -115:2 10 <
ffff8800a2139840 4105100416 C Ii:6:013:2 0:2 10 = 93dd0203 04050607 0809
ffff8800a2139840 4105101344 S Ii:6:013:2 -115:2 10 <
ffff8800a2139840 4105106432 C Ii:6:013:2 0:2 10 = 93de0203 04050607 0809
ffff8800a2139840 4105106880 S Ii:6:013:2 -115:2 10 <
ffff8800a2139840 4105110417 C Ii:6:013:2 0:2 10 = 93df0203 04050607 0809
ffff8800a2139840 4105111292 S Ii:6:013:2 -115:2 10 <
ffff8800a2139840 4105116417 C Ii:6:013:2 0:2 10 = 93e00203 04050607 0809
ffff8800a2139840 4105116818 S Ii:6:013:2 -115:2 10 <
ffff8800a2139840 4105122432 C Ii:6:013:2 0:2 10 = 93e10203 04050607 0809
ffff8800a2139840 4105123381 S Ii:6:013:2 -115:2 10 <
ffff8800a2139840 4105126416 C Ii:6:013:2 0:2 10 = 93e20203 04050607 0809
ffff8800a2139840 4105126726 S Ii:6:013:2 -115:2 10 <
ffff8800a2139840 4105132434 C Ii:6:013:2 0:2 10 = 93e30203 04050607 0809
ffff8800a2139840 4105133294 S Ii:6:013:2 -115:2 10 <
ffff8800a2139840 4105138434 C Ii:6:013:2 0:2 10 = 93e40203 04050607 0809
ffff8800a2139840 4105138798 S Ii:6:013:2 -115:2 10 <
ffff8800a2139840 4105144434 C Ii:6:013:2 0:2 10 = 93e50203 04050607 0809
ffff8800a2139840 4105145382 S Ii:6:013:2 -115:2 10 <
ffff8800a2139840 4105147432 C Ii:6:013:2 0:2 10 = 93e60203 04050607 0809
ffff8800a2139840 4105147574 S Ii:6:013:2 -115:2 10 <
ffff8800a2139840 4105154434 C Ii:6:013:2 0:2 10 = 93e70203 04050607 0809
ffff8800a2139840 4105155240 S Ii:6:013:2 -115:2 10 <
ffff8800a2139840 4105160432 C Ii:6:013:2 0:2 10 = 93e80203 04050607 0809
ffff8800a2139840 4105160700 S Ii:6:013:2 -115:2 10 <
ffff8800a2139840 4105166416 C Ii:6:013:2 0:2 10 = 93e90203 04050607 0809
ffff8800a2139840 4105167345 S Ii:6:013:2 -115:2 10 <
ffff8800a2139840 4105169431 C Ii:6:013:2 0:2 10 = 93ea0203 04050607 0809
ffff8800a2139840 4105169588 S Ii:6:013:2 -115:2 10 <
ffff8800a2139840 4105176417 C Ii:6:013:2 0:2 10 = 93eb0203 04050607 0809
ffff8800a2139840 4105177304 S Ii:6:013:2 -115:2 10 <
ffff8800a2139840 4105182433 C Ii:6:013:2 0:2 10 = 93ec0203 04050607 0809
ffff8800a2139840 4105182778 S Ii:6:013:2 -115:2 10 <
ffff8800a2139840 4105188432 C Ii:6:013:2 0:2 10 = 93ed0203 04050607 0809
ffff8800a2139840 4105189397 S Ii:6:013:2 -115:2 10 <
ffff8800a2139840 4105192433 C Ii:6:013:2 0:2 10 = 93ee0203 04050607 0809
ffff8800a2139840 4105192720 S Ii:6:013:2 -115:2 10 <
ffff8800a2139840 4105198416 C Ii:6:013:2 0:2 10 = 93ef0203 04050607 0809
ffff8800a2139840 4105199362 S Ii:6:013:2 -115:2 10 <
ffff8800a2139840 4105204434 C Ii:6:013:2 0:2 10 = 93f00203 04050607 0809
ffff8800a2139840 4105204845 S Ii:6:013:2 -115:2 10 <
ffff8800a2139840 4105207530 C Ii:6:013:2 0:2 10 = 93f10203 04050607 0809
ffff8800a2139840 4105207559 S Ii:6:013:2 -115:2 10 <
ffff8800a2139840 4105214435 C Ii:6:013:2 0:2 10 = 93f20203 04050607 0809
ffff8800a2139840 4105215231 S Ii:6:013:2 -115:2 10 <
ffff8800a2139840 4105220431 C Ii:6:013:2 0:2 10 = 93f30203 04050607 0809
ffff8800a2139840 4105220731 S Ii:6:013:2 -115:2 10 <
ffff8800a2139840 4105226433 C Ii:6:013:2 0:2 10 = 93f40203 04050607 0809
ffff8800a2139840 4105227334 S Ii:6:013:2 -115:2 10 <
ffff8800a2139840 4105229432 C Ii:6:013:2 0:2 10 = 93f50203 04050607 0809
ffff8800a2139840 4105229563 S Ii:6:013:2 -115:2 10 <
ffff8800a2139840 4105236464 C Ii:6:013:2 0:2 10 = 93f60203 04050607 0809
ffff8800a2139840 4105236577 S Ii:6:013:2 -115:2 10 <
ffff8800a2139840 4105242441 C Ii:6:013:2 0:2 10 = 93f70203 04050607 0809
ffff8800a2139840 4105242552 S Ii:6:013:2 -115:2 10 <
ffff8800a2139840 4105248416 C Ii:6:013:2 0:2 10 = 93f80203 04050607 0809
ffff8800a2139840 4105249198 S Ii:6:013:2 -115:2 10 <
ffff8800a2139840 4105251433 C Ii:6:013:2 0:2 10 = 93f90203 04050607 0809
ffff8800a2139840 4105252504 S Ii:6:013:2 -115:2 10 <
ffff8800a2139840 4105258431 C Ii:6:013:2 0:2 10 = 93fa0203 04050607 0809
ffff8800a2139840 4105259085 S Ii:6:013:2 -115:2 10 <
ffff8800a2139840 4105264419 C Ii:6:013:2 0:2 10 = 93fb0203 04050607 0809
ffff8800a2139840 4105264584 S Ii:6:013:2 -115:2 10 <
ffff8800a2139840 4105267432 C Ii:6:013:2 0:2 10 = 93fc0203 04050607 0809
ffff8800a2139840 4105267867 S Ii:6:013:2 -115:2 10 <
ffff8800a2139840 4105274438 C Ii:6:013:2 0:2 10 = 93fd0203 04050607 0809
ffff8800a2139840 4105274454 S Ii:6:013:2 -115:2 10 <
ffff8800a2139840 4105280416 C Ii:6:013:2 0:2 10 = 93fe0203 04050607 0809
ffff8800a2139840 4105281088 S Ii:6:013:2 -115:2 10 <
ffff8800a2139840 4105286416 C Ii:6:013:2 0:2 10 = 93ff0203 04050607 0809
ffff8800a2139840 4105286586 S Ii:6:013:2 -115:2 10 <
ffff8800a2139840 4105289432 C Ii:6:013:2 0:2 10 = 93000203 04050607 0809
ffff8800a2139840 4105289867 S Ii:6:013:2 -115:2 10 <
ffff8800a2139840 4105296416 C Ii:6:013:2 0:2 10 = 93010203 04050607 0809
ffff8800a2139840 4105296448 S Ii:6:013:2 -115:2 10 <
ffff8800a2139840 4105302433 C Ii:6:013:2 0:2 10 = 93020203 04050607 0809
ffff8800a2139840 4105303013 S Ii:6:013:2 -115:2 10 <
ffff8800a2139840 4105308435 C Ii:6:013:2 0:2 10 = 93030203 04050607 0809
ffff8800a2139840 4105309528 S Ii:6:013:2 -115:2 10 <
ffff8800a2139840 4105311435 C Ii:6:013:2 0:2 10 = 93040203 04050607 0809
ffff8800a2139840 4105311721 S Ii:6:013:2 -115:2 10 <
ffff8800a2139840 4105318433 C Ii:6:013:2 0:2 10 = 93050203 04050607 0809
ffff8800a2139840 4105319392 S Ii:6:013:2 -115:2 10 <
ffff8800a2139840 4105324418 C Ii:6:013:2 0:2 10 = 93060203 04050607 0809
ffff8800a2139840 4105324884 S Ii:6:013:2 -115:2 10 <
ffff8800a2139840 4105327432 C Ii:6:013:2 0:2 10 = 93070203 04050607 0809
ffff8800a2139840 4105328167 S Ii:6:013:2 -115:2 10 <
ffff8800a2139840 4105334420 C Ii:6:013:2 0:2 10 = 93080203 04050607 0809
ffff8800a2139840 4105334752 S Ii:6:013:2 -115:2 10 <
ffff8800a2139840 4105340432 C Ii:6:013:2 0:2 10 = 93090203 04050607 0809
ffff8800a2139840 4105341337 S Ii:6:013:2 -115:2 10 <
ffff8800a2139840 4105346432 C Ii:6:013:2 0:2 10 = 930a0203 04050607 0809
ffff8800a2139840 4105346864 S Ii:6:013:2 -115:2 10 <
ffff8800a2139840 4105350416 C Ii:6:013:2 0:2 10 = 930b0203 04050607 0809
ffff8800a2139840 4105351315 S Ii:6:013:2 -115:2 10 <
ffff8800a2139840 4105356416 C Ii:6:013:2 0:2 10 = 930c0203 04050607 0809
ffff8800a2139840 4105356830 S Ii:6:013:2 -115:2 10 <
ffff8800a2139840 4105362433 C Ii:6:013:2 0:2 10 = 930d0203 04050607 0809
ffff8800a2139840 4105363371 S Ii:6:013:2 -115:2 10 <
ffff8800a2139840 4105368433 C Ii:6:013:2 0:2 10 = 930e0203 04050607 0809
ffff8800a2139840 4105368846 S Ii:6:013:2 -115:2 10 <
ffff8800a2139840 4105372415 C Ii:6:013:2 0:2 10 = 930f0203 04050607 0809
ffff8800a2139840 4105373314 S Ii:6:013:2 -115:2 10 <
ffff8800a2139840 4105378443 C Ii:6:013:2 0:2 10 = 93100203 04050607 0809
ffff8800a2139840 4105379158 S Ii:6:013:2 -115:2 10 <
ffff8800a2139840 4105384455 C Ii:6:013:2 0:2 10 = 93110203 04050607 0809
ffff8800a2139840 4105385352 S Ii:6:013:2 -115:2 10 <
ffff8800a2139840 4105390527 C Ii:6:013:2 0:2 10 = 93120203 04050607 0809
ffff8800a2139840 4105390579 S Ii:6:013:2 -115:2 10 <
ffff8800a2139840 4105394423 C Ii:6:013:2 0:2 10 = 93130203 04050607 0809
ffff8800a2139840 4105395325 S Ii:6:013:2 -115:2 10 <
ffff8800a2139840 4105400416 C Ii:6:013:2 0:2 10 = 93140203 04050607 0809
ffff8800a2139840 4105400863 S Ii:6:013:2 -115:2 10 <
ffff8800a2139840 4105406437 C Ii:6:013:2 0:2 10 = 93150203 04050607 0809
ffff8800a2139840 4105407485 S Ii:6:013:2 -115:2 10 <
ffff8800a2139840 4105409432 C Ii:6:013:2 0:2 10 = 93160203 04050607 0809
ffff8800a2139840 4105409687 S Ii:6:013:2 -115:2 10 <
ffff8800a2139840 4105416433 C Ii:6:013:2 0:2 10 = 93170203 04050607 0809
ffff8800a2139840 4105417357 S Ii:6:013:2 -115:2 10 <
ffff8800a2139840 4105422417 C Ii:6:013:2 0:2 10 = 93180203 04050607 0809
ffff8800a2139840 4105422884 S Ii:6:013:2 -115:2 10 <
ffff8800a2139840 4105428432 C Ii:6:013:2 0:2 10 = 93190203 04050607 0809
ffff8800a2139840 4105429469 S Ii:6:013:2 -115:2 10 <
ffff8800a2139840 4105431434 C Ii:6:013:2 0:2 10 = 931a0203 04050607 0809
ffff8800a2139840 4105431664 S Ii:6:013:2 -115:2 10 <
ffff8800a2139840 4105438432 C Ii:6:013:2 0:2 10 = 931b0203 04050607 0809
ffff8800a2139840 4105439320 S Ii:6:013:2 -115:2 10 <
ffff8800a2139840 4105444418 C Ii:6:013:2 0:2 10 = 931c0203 04050607 0809
ffff8800a2139840 4105444856 S Ii:6:013:2 -115:2 10 <
ffff8800a2139840 4105450419 C Ii:6:013:2 0:2 10 = 931d0203 04050607 0809
ffff8800a2139840 4105451469 S Ii:6:013:2 -115:2 10 <
ffff8800a2139840 4105454418 C Ii:6:013:2 0:2 10 = 931e0203 04050607 0809
ffff8800a2139840 4105454811 S Ii:6:013:2 -115:2 10 <
ffff8800a2139840 4105460433 C Ii:6:013:2 0:2 10 = 931f0203 04050607 0809
ffff8800a2139840 4105461356 S Ii:6:013:2 -115:2 10 <
ffff8800a2139840 4105466433 C Ii:6:013:2 0:2 10 = 93200203 04050607 0809
ffff8800a2139840 4105466834 S Ii:6:013:2 -115:2 10 <
ffff8800a2139840 4105470417 C Ii:6:013:2 0:2 10 = 93210203 04050607 0809
ffff8800a2139840 4105471286 S Ii:6:013:2 -115:2 10 <
ffff8800a2139840 4105476433 C Ii:6:013:2 0:2 10 = 93220203 04050607 0809
ffff8800a2139840 4105476765 S Ii:6:013:2 -115:2 10 <
ffff8800a2139840 4105482410 C Ii:6:013:2 0:2 10 = 93230203 04050607 0809
ffff8800a2139840 4105483363 S Ii:6:013:2 -115:2 10 <
ffff8800a2139840 4105487759 C Ii:6:013:2 0:2 10 = 93240203 04050607 0809
ffff8800a2139840 4105488897 S Ii:6:013:2 -115:2 10 <
ffff8800a2139840 4105492432 C Ii:6:013:2 0:2 10 = 93250203 04050607 0809
ffff8800a2139840 4105493289 S Ii:6:013:2 -115:2 10 <
ffff8800a2139840 4105498433 C Ii:6:013:2 0:2 10 = 93260203 04050607 0809
ffff8800a2139840 4105498824 S Ii:6:013:2 -115:2 10 <
ffff8800a2139840 4105504434 C Ii:6:013:2 0:2 10 = 93270203 04050607 0809
ffff8800a2139840 4105505380 S Ii:6:013:2 -115:2 10 <
ffff8800a2139840 4105510417 C Ii:6:013:2 0:2 10 = 93280203 04050607 0809
ffff8800a2139840 4105510874 S Ii:6:013:2 -115:2 10 <
ffff8800a2139840 4105513432 C Ii:6:013:2 0:2 10 = 93290203 04050607 0809
ffff8800a2139840 4105514158 S Ii:6:013:2 -115:2 10 <
ffff8800a2139840 4105520417 C Ii:6:013:2 0:2 10 = 932a0203 04050607 0809
ffff8800a2139840 4105520761 S Ii:6:013:2 -115:2 10 <
ffff8800a2139840 4105526417 C Ii:6:013:2 0:2 10 = 932b0203 04050607 0809
ffff8800a2139840 4105527339 S Ii:6:013:2 -115:2 10 <
ffff8800a2139840 4105532410 C Ii:6:013:2 0:2 10 = 932c0203 04050607 0809
ffff8800a2139840 4105532844 S Ii:6:013:2 -115:2 10 <
ffff8800a2139840 4105536416 C Ii:6:013:2 0:2 10 = 932d0203 04050607 0809
ffff8800a2139840 4105537294 S Ii:6:013:2 -115:2 10 <
ffff8800a2139840 4105542433 C Ii:6:013:2 0:2 10 = 932e0203 04050607 0809
ffff8800a2139840 4105542773 S Ii:6:013:2 -115:2 10 <
ffff8800a2139840 4105548416 C Ii:6:013:2 0:2 10 = 932f0203 04050607 0809
ffff8800a2139840 4105549420 S Ii:6:013:2 -115:2 10 <
ffff8800a2139840 4105552416 C Ii:6:013:2 0:2 10 = 93300203 04050607 0809
ffff8800a2139840 4105552762 S Ii:6:013:2 -115:2 10 <
ffff8800a2139840 4105558433 C Ii:6:013:2 0:2 10 = 93310203 04050607 0809
ffff8800a2139840 4105559480 S Ii:6:013:2 -115:2 10 <
ffff8800a2139840 4105564418 C Ii:6:013:2 0:2 10 = 93320203 04050607 0809
ffff8800a2139840 4105565016 S Ii:6:013:2 -115:2 10 <
ffff8800a2139840 4105570417 C Ii:6:013:2 0:2 10 = 93330203 04050607 0809
ffff8800a2139840 4105570472 S Ii:6:013:2 -115:2 10 <
ffff8800a2139840 4105573432 C Ii:6:013:2 0:2 10 = 93340203 04050607 0809
ffff8800a2139840 4105573756 S Ii:6:013:2 -115:2 10 <
ffff8800a2139840 4105580416 C Ii:6:013:2 0:2 10 = 93350203 04050607 0809
ffff8800a2139840 4105581463 S Ii:6:013:2 -115:2 10 <
ffff8800a2139840 4105586417 C Ii:6:013:2 0:2 10 = 93360203 04050607 0809
ffff8800a2139840 4105586961 S Ii:6:013:2 -115:2 10 <
ffff8800a2139840 4105592425 C Ii:6:013:2 0:2 10 = 93370203 04050607 0809
ffff8800a2139840 4105592474 S Ii:6:013:2 -115:2 10 <
ffff8800a2139840 4105596416 C Ii:6:013:2 0:2 10 = 93380203 04050607 0809
ffff8800a2139840 4105596925 S Ii:6:013:2 -115:2 10 <
ffff8800a2139840 4105602415 C Ii:6:013:2 0:2 10 = 93390203 04050607 0809
ffff8800a2139840 4105602464 S Ii:6:013:2 -115:2 10 <
ffff8800a2139840 4105608418 C Ii:6:013:2 0:2 10 = 933a0203 04050607 0809
ffff8800a2139840 4105609064 S Ii:6:013:2 -115:2 10 <
ffff8800a2139840 4105612416 C Ii:6:013:2 0:2 10 = 933b0203 04050607 0809
ffff8800a2139840 4105613487 S Ii:6:013:2 -115:2 10 <
ffff8800a2139840 4105618416 C Ii:6:013:2 0:2 10 = 933c0203 04050607 0809
ffff8800a2139840 4105619023 S Ii:6:013:2 -115:2 10 <
ffff8800a2139840 4105624435 C Ii:6:013:2 0:2 10 = 933d0203 04050607 0809
ffff8800a2139840 4105624504 S Ii:6:013:2 -115:2 10 <
ffff8800a2139840 4105630433 C Ii:6:013:2 0:2 10 = 933e0203 04050607 0809
ffff8800a2139840 4105631087 S Ii:6:013:2 -115:2 10 <
ffff8800a2139840 4105634424 C Ii:6:013:2 0:2 10 = 933f0203 04050607 0809
ffff8800a2139840 4105634452 S Ii:6:013:2 -115:2 10 <
ffff8800a2139840 4105640416 C Ii:6:013:2 0:2 10 = 93400203 04050607 0809
ffff8800a2139840 4105641090 S Ii:6:013:2 -115:2 10 <
ffff8800a2139840 4105646433 C Ii:6:013:2 0:2 10 = 93410203 04050607 0809
ffff8800a2139840 4105646610 S Ii:6:013:2 -115:2 10 <
ffff8800a2139840 4105652617 C Ii:6:013:2 0:2 10 = 93420203 04050607 0809
ffff8800a2139840 4105652767 S Ii:6:013:2 -115:2 10 <
ffff8800a2139840 4105655445 C Ii:6:013:2 0:2 10 = 93430203 04050607 0809
ffff8800a2139840 4105656669 S Ii:6:013:2 -115:2 10 <
ffff8800a2139840 4105662437 C Ii:6:013:2 0:2 10 = 93440203 04050607 0809
ffff8800a2139840 4105663308 S Ii:6:013:2 -115:2 10 <
ffff8800a2139840 4105668434 C Ii:6:013:2 0:2 10 = 93450203 04050607 0809
ffff8800a2139840 4105668817 S Ii:6:013:2 -115:2 10 <
ffff8800a2139840 4105672417 C Ii:6:013:2 0:2 10 = 93460203 04050607 0809
ffff8800a2139840 4105673267 S Ii:6:013:2 -115:2 10 <
ffff8800a2139840 4105678434 C Ii:6:013:2 0:2 10 = 93470203 04050607 0809
ffff8800a2139840 4105678763 S Ii:6:013:2 -115:2 10 <
ffff8800a2139840 4105684420 C Ii:6:013:2 0:2 10 = 93480203 04050607 0809
ffff8800a2139840 4105685393 S Ii:6:013:2 -115:2 10 <
ffff8800a2139840 4105690416 C Ii:6:013:2 0:2 10 = 93490203 04050607 0809
ffff8800a2139840 4105690934 S Ii:6:013:2 -115:2 10 <
ffff8800a2139840 4105694417 C Ii:6:013:2 0:2 10 = 934a0203 04050607 0809
ffff8800a2139840 4105695367 S Ii:6:013:2 -115:2 10 <
ffff8800a2139840 4105700417 C Ii:6:013:2 0:2 10 = 934b0203 04050607 0809
ffff8800a2139840 4105700903 S Ii:6:013:2 -115:2 10 <
ffff8800a2139840 4105706412 C Ii:6:013:2 0:2 10 = 934c0203 04050607 0809
ffff8800a2139840 4105707467 S Ii:6:013:2 -115:2 10 <
ffff8800a2139840 4105712417 C Ii:6:013:2 0:2 10 = 934d0203 04050607 0809
ffff8800a2139840 4105713015 S Ii:6:013:2 -115:2 10 <
ffff8800a2139840 4105716417 C Ii:6:013:2 0:2 10 = 934e0203 04050607 0809
ffff8800a2139840 4105717467 S Ii:6:013:2 -115:2 10 <
ffff8800a2139840 4105722417 C Ii:6:013:2 0:2 10 = 934f0203 04050607 0809
ffff8800a2139840 4105723002 S Ii:6:013:2 -115:2 10 <
ffff8800a2139840 4105728435 C Ii:6:013:2 0:2 10 = 93500203 04050607 0809
ffff8800a2139840 4105728505 S Ii:6:013:2 -115:2 10 <
ffff8800a2139840 4105734421 C Ii:6:013:2 0:2 10 = 93510203 04050607 0809
ffff8800a2139840 4105735128 S Ii:6:013:2 -115:2 10 <
ffff8800a2139840 4105737432 C Ii:6:013:2 0:2 10 = 93520203 04050607 0809
ffff8800a2139840 4105738426 S Ii:6:013:2 -115:2 10 <
ffff8800a2139840 4105744617 C Ii:6:013:2 0:2 10 = 93530203 04050607 0809
ffff8800a2139840 4105744855 S Ii:6:013:2 -115:2 10 <
ffff8800a2139840 4105750617 C Ii:6:013:2 0:2 10 = 93540203 04050607 0809
ffff8800a2139840 4105751374 S Ii:6:013:2 -115:2 10 <
ffff8800a2139840 4105753616 C Ii:6:013:2 0:2 10 = 93550203 04050607 0809
ffff8800a2139840 4105753761 S Ii:6:013:2 -115:2 10 <
ffff8800a2139840 4105760441 C Ii:6:013:2 0:2 10 = 93560203 04050607 0809
ffff8800a2139840 4105760736 S Ii:6:013:2 -115:2 10 <
ffff8800a2139840 4105766417 C Ii:6:013:2 0:2 10 = 93570203 04050607 0809
ffff8800a2139840 4105767387 S Ii:6:013:2 -115:2 10 <
ffff8800a2139840 4105772417 C Ii:6:013:2 0:2 10 = 93580203 04050607 0809
ffff8800a2139840 4105772920 S Ii:6:013:2 -115:2 10 <
ffff8800a2139840 4105775432 C Ii:6:013:2 0:2 10 = 93590203 04050607 0809
ffff8800a2139840 4105776223 S Ii:6:013:2 -115:2 10 <
ffff8800a2139840 4105782410 C Ii:6:013:2 0:2 10 = 935a0203 04050607 0809
ffff8800a2139840 4105782805 S Ii:6:013:2 -115:2 10 <
ffff8800a2139840 4105788411 C Ii:6:013:2 0:2 10 = 935b0203 04050607 0809
ffff8800a2139840 4105788616 S Ii:6:013:2 -115:2 10 <
ffff8800a2139840 4105794435 C Ii:6:013:2 0:2 10 = 935c0203 04050607 0809
ffff8800a2139840 4105795239 S Ii:6:013:2 -115:2 10 <
ffff8800a2139840 4105797438 C Ii:6:013:2 0:2 10 = 935d0203 04050607 0809
ffff8800a2139840 4105797458 S Ii:6:013:2 -115:2 10 <
ffff8800a2139840 4105804461 C Ii:6:013:2 0:2 10 = 935e0203 04050607 0809
ffff8800a2139840 4105804510 S Ii:6:013:2 -115:2 10 <
ffff8800a2139840 4105810424 C Ii:6:013:2 0:2 10 = 935f0203 04050607 0809
ffff8800a2139840 4105811521 S Ii:6:013:2 -115:2 10 <
ffff8800a2139840 4105813432 C Ii:6:013:2 0:2 10 = 93600203 04050607 0809
ffff8800a2139840 4105813722 S Ii:6:013:2 -115:2 10 <
ffff8800a2139840 4105820417 C Ii:6:013:2 0:2 10 = 93610203 04050607 0809
ffff8800a2139840 4105821408 S Ii:6:013:2 -115:2 10 <
ffff8800a2139840 4105826433 C Ii:6:013:2 0:2 10 = 93620203 04050607 0809
ffff8800a2139840 4105826928 S Ii:6:013:2 -115:2 10 <
ffff8800a2139840 4105832410 C Ii:6:013:2 0:2 10 = 93630203 04050607 0809
ffff8800a2139840 4105832439 S Ii:6:013:2 -115:2 10 <
ffff8800a2139840 4105836416 C Ii:6:013:2 0:2 10 = 93640203 04050607 0809
ffff8800a2139840 4105836871 S Ii:6:013:2 -115:2 10 <
ffff8800a2139840 4105842433 C Ii:6:013:2 0:2 10 = 93650203 04050607 0809
ffff8800a2139840 4105843451 S Ii:6:013:2 -115:2 10 <
ffff8800a2139840 4105848416 C Ii:6:013:2 0:2 10 = 93660203 04050607 0809
ffff8800a2139840 4105848984 S Ii:6:013:2 -115:2 10 <
ffff8800a2139840 4105854418 C Ii:6:013:2 0:2 10 = 93670203 04050607 0809
ffff8800a2139840 4105854483 S Ii:6:013:2 -115:2 10 <
ffff8800a2139840 4105858431 C Ii:6:013:2 0:2 10 = 93680203 04050607 0809
ffff8800a2139840 4105858870 S Ii:6:013:2 -115:2 10 <
ffff8800a2139840 4105864421 C Ii:6:013:2 0:2 10 = 93690203 04050607 0809
ffff8800a2139840 4105864441 S Ii:6:013:2 -115:2 10 <
ffff8800a2139840 4105870415 C Ii:6:013:2 0:2 10 = 936a0203 04050607 0809
ffff8800a2139840 4105871088 S Ii:6:013:2 -115:2 10 <
ffff8800a2139840 4105876432 C Ii:6:013:2 0:2 10 = 936b0203 04050607 0809
ffff8800a2139840 4105876553 S Ii:6:013:2 -115:2 10 <
ffff8800a2139840 4105880417 C Ii:6:013:2 0:2 10 = 936c0203 04050607 0809
ffff8800a2139840 4105881003 S Ii:6:013:2 -115:2 10 <
ffff8800a2139840 4105886416 C Ii:6:013:2 0:2 10 = 936d0203 04050607 0809
ffff8800a2139840 4105886475 S Ii:6:013:2 -115:2 10 <
ffff8800a2139840 4105892432 C Ii:6:013:2 0:2 10 = 936e0203 04050607 0809
ffff8800a2139840 4105893058 S Ii:6:013:2 -115:2 10 <
ffff8800a2139840 4105895432 C Ii:6:013:2 0:2 10 = 936f0203 04050607 0809
ffff8800a2139840 4105896340 S Ii:6:013:2 -115:2 10 <
ffff8800a2139840 4105902432 C Ii:6:013:2 0:2 10 = 93700203 04050607 0809
ffff8800a2139840 4105902977 S Ii:6:013:2 -115:2 10 <
ffff8800a2139840 4105908415 C Ii:6:013:2 0:2 10 = 93710203 04050607 0809
ffff8800a2139840 4105908479 S Ii:6:013:2 -115:2 10 <
ffff8800a2139840 4105914434 C Ii:6:013:2 0:2 10 = 93720203 04050607 0809
ffff8800a2139840 4105915058 S Ii:6:013:2 -115:2 10 <
ffff8800a2139840 4105918410 C Ii:6:013:2 0:2 10 = 93730203 04050607 0809
ffff8800a2139840 4105919492 S Ii:6:013:2 -115:2 10 <
ffff8800a2139840 4105924434 C Ii:6:013:2 0:2 10 = 93740203 04050607 0809
ffff8800a2139840 4105924966 S Ii:6:013:2 -115:2 10 <
ffff8800a2139840 4105930417 C Ii:6:013:2 0:2 10 = 93750203 04050607 0809
ffff8800a2139840 4105930474 S Ii:6:013:2 -115:2 10 <
ffff8800a2139840 4105936432 C Ii:6:013:2 0:2 10 = 93760203 04050607 0809
ffff8800a2139840 4105937024 S Ii:6:013:2 -115:2 10 <
ffff8800a2139840 4105940417 C Ii:6:013:2 0:2 10 = 93770203 04050607 0809
ffff8800a2139840 4105941478 S Ii:6:013:2 -115:2 10 <
ffff8800a2139840 4105946432 C Ii:6:013:2 0:2 10 = 93780203 04050607 0809
ffff8800a2139840 4105946978 S Ii:6:013:2 -115:2 10 <
ffff8800a2139840 4105952432 C Ii:6:013:2 0:2 10 = 93790203 04050607 0809
ffff8800a2139840 4105952498 S Ii:6:013:2 -115:2 10 <
ffff8800a2139840 4105956417 C Ii:6:013:2 0:2 10 = 937a0203 04050607 0809
ffff8800a2139840 4105956945 S Ii:6:013:2 -115:2 10 <
ffff8800a2139840 4105962415 C Ii:6:013:2 0:2 10 = 937b0203 04050607 0809
ffff8800a2139840 4105963508 S Ii:6:013:2 -115:2 10 <
ffff8800a2139840 4105968432 C Ii:6:013:2 0:2 10 = 937c0203 04050607 0809
ffff8800a2139840 4105968988 S Ii:6:013:2 -115:2 10 <
ffff8800a2139840 4105974434 C Ii:6:013:2 0:2 10 = 937d0203 04050607 0809
ffff8800a2139840 4105974504 S Ii:6:013:2 -115:2 10 <
ffff8800a2139840 4105977432 C Ii:6:013:2 0:2 10 = 937e0203 04050607 0809
ffff8800a2139840 4105977813 S Ii:6:013:2 -115:2 10 <
ffff8800a2139840 4105984427 C Ii:6:013:2 0:2 10 = 937f0203 04050607 0809
ffff8800a2139840 4105985682 S Ii:6:013:2 -115:2 10 <
ffff8800a2139840 4105990615 C Ii:6:013:2 0:2 10 = 93800203 04050607 0809
ffff8800a2139840 4105990667 S Ii:6:013:2 -115:2 10 <
ffff8800a2139840 4105996616 C Ii:6:013:2 0:2 10 = 93810203 04050607 0809
ffff8800a2139840 4105997024 S Ii:6:013:2 -115:2 10 <
ffff8800a2139840 4105999632 C Ii:6:013:2 0:2 10 = 93820203 04050607 0809
ffff8800a2139840 4105999746 S Ii:6:013:2 -115:2 10 <
ffff8800a2139840 4106006599 C Ii:6:013:2 0:2 10 = 93830203 04050607 0809
ffff8800a2139840 4106007460 S Ii:6:013:2 -115:2 10 <
ffff8800a2139840 4106012435 C Ii:6:013:2 0:2 10 = 93840203 04050607 0809
ffff8800a2139840 4106012939 S Ii:6:013:2 -115:2 10 <
ffff8800a2139840 4106015432 C Ii:6:013:2 0:2 10 = 93850203 04050607 0809
ffff8800a2139840 4106016223 S Ii:6:013:2 -115:2 10 <
ffff8800a2139840 4106022418 C Ii:6:013:2 0:2 10 = 93860203 04050607 0809
ffff8800a2139840 4106022830 S Ii:6:013:2 -115:2 10 <
ffff8800a2139840 4106028432 C Ii:6:013:2 0:2 10 = 93870203 04050607 0809
ffff8800a2139840 4106029461 S Ii:6:013:2 -115:2 10 <
ffff8800a2139840 4106034434 C Ii:6:013:2 0:2 10 = 93880203 04050607 0809
ffff8800a2139840 4106034901 S Ii:6:013:2 -115:2 10 <
ffff8800a2139840 4106038417 C Ii:6:013:2 0:2 10 = 93890203 04050607 0809
ffff8800a2139840 4106039350 S Ii:6:013:2 -115:2 10 <
ffff8800a2139840 4106044419 C Ii:6:013:2 0:2 10 = 938a0203 04050607 0809
ffff8800a2139840 4106044908 S Ii:6:013:2 -115:2 10 <
ffff8800a2139840 4106050435 C Ii:6:013:2 0:2 10 = 938b0203 04050607 0809
ffff8800a2139840 4106051476 S Ii:6:013:2 -115:2 10 <
ffff8800a2139840 4106056432 C Ii:6:013:2 0:2 10 = 938c0203 04050607 0809
ffff8800a2139840 4106056947 S Ii:6:013:2 -115:2 10 <
ffff8800a2139840 4106059433 C Ii:6:013:2 0:2 10 = 938d0203 04050607 0809
ffff8800a2139840 4106060233 S Ii:6:013:2 -115:2 10 <
ffff8800a2139840 4106066432 C Ii:6:013:2 0:2 10 = 938e0203 04050607 0809
ffff8800a2139840 4106066836 S Ii:6:013:2 -115:2 10 <
ffff8800a2139840 4106072417 C Ii:6:013:2 0:2 10 = 938f0203 04050607 0809
ffff8800a2139840 4106073484 S Ii:6:013:2 -115:2 10 <
ffff8800a2139840 4106078432 C Ii:6:013:2 0:2 10 = 93900203 04050607 0809
ffff8800a2139840 4106079067 S Ii:6:013:2 -115:2 10 <
ffff8800a2139840 4106082410 C Ii:6:013:2 0:2 10 = 93910203 04050607 0809
ffff8800a2139840 4106083478 S Ii:6:013:2 -115:2 10 <
ffff8800a2139840 4106088417 C Ii:6:013:2 0:2 10 = 93920203 04050607 0809
ffff8800a2139840 4106089015 S Ii:6:013:2 -115:2 10 <
ffff8800a2139840 4106094434 C Ii:6:013:2 0:2 10 = 93930203 04050607 0809
ffff8800a2139840 4106094505 S Ii:6:013:2 -115:2 10 <
ffff8800a2139840 4106098417 C Ii:6:013:2 0:2 10 = 93940203 04050607 0809
ffff8800a2139840 4106098955 S Ii:6:013:2 -115:2 10 <
ffff8800a2139840 4106104431 C Ii:6:013:2 0:2 10 = 93950203 04050607 0809
ffff8800a2139840 4106105519 S Ii:6:013:2 -115:2 10 <
ffff8800a2139840 4106110433 C Ii:6:013:2 0:2 10 = 93960203 04050607 0809
ffff8800a2139840 4106111023 S Ii:6:013:2 -115:2 10 <
ffff8800a2139840 4106116432 C Ii:6:013:2 0:2 10 = 93970203 04050607 0809
ffff8800a2139840 4106116549 S Ii:6:013:2 -115:2 10 <
ffff8800a2139840 4106120417 C Ii:6:013:2 0:2 10 = 93980203 04050607 0809
ffff8800a2139840 4106121000 S Ii:6:013:2 -115:2 10 <
ffff8800a2139840 4106126432 C Ii:6:013:2 0:2 10 = 93990203 04050607 0809
ffff8800a2139840 4106126500 S Ii:6:013:2 -115:2 10 <
ffff8800a2139840 4106132410 C Ii:6:013:2 0:2 10 = 939a0203 04050607 0809
ffff8800a2139840 4106133040 S Ii:6:013:2 -115:2 10 <
ffff8800a2139840 4106138434 C Ii:6:013:2 0:2 10 = 939b0203 04050607 0809
ffff8800a2139840 4106138560 S Ii:6:013:2 -115:2 10 <
ffff8800a2139840 4106142416 C Ii:6:013:2 0:2 10 = 939c0203 04050607 0809
ffff8800a2139840 4106143009 S Ii:6:013:2 -115:2 10 <
ffff8800a2139840 4106148435 C Ii:6:013:2 0:2 10 = 939d0203 04050607 0809
ffff8800a2139840 4106148522 S Ii:6:013:2 -115:2 10 <
ffff8800a2139840 4106154417 C Ii:6:013:2 0:2 10 = 939e0203 04050607 0809
ffff8800a2139840 4106155162 S Ii:6:013:2 -115:2 10 <
ffff8800a2139840 4106157433 C Ii:6:013:2 0:2 10 = 939f0203 04050607 0809
ffff8800a2139840 4106158424 S Ii:6:013:2 -115:2 10 <
ffff8800a2139840 4106164419 C Ii:6:013:2 0:2 10 = 93a00203 04050607 0809
ffff8800a2139840 4106165018 S Ii:6:013:2 -115:2 10 <
ffff8800a2139840 4106170416 C Ii:6:013:2 0:2 10 = 93a10203 04050607 0809
ffff8800a2139840 4106170487 S Ii:6:013:2 -115:2 10 <
ffff8800a2139840 4106176433 C Ii:6:013:2 0:2 10 = 93a20203 04050607 0809
ffff8800a2139840 4106177046 S Ii:6:013:2 -115:2 10 <
ffff8800a2139840 4106179433 C Ii:6:013:2 0:2 10 = 93a30203 04050607 0809
ffff8800a2139840 4106180330 S Ii:6:013:2 -115:2 10 <
ffff8800a2139840 4106186416 C Ii:6:013:2 0:2 10 = 93a40203 04050607 0809
ffff8800a2139840 4106186922 S Ii:6:013:2 -115:2 10 <
ffff8800a2139840 4106192432 C Ii:6:013:2 0:2 10 = 93a50203 04050607 0809
ffff8800a2139840 4106193487 S Ii:6:013:2 -115:2 10 <
ffff8800a2139840 4106198417 C Ii:6:013:2 0:2 10 = 93a60203 04050607 0809
ffff8800a2139840 4106199023 S Ii:6:013:2 -115:2 10 <
ffff8800a2139840 4106201432 C Ii:6:013:2 0:2 10 = 93a70203 04050607 0809
ffff8800a2139840 4106202311 S Ii:6:013:2 -115:2 10 <
ffff8800a2139840 4106208412 C Ii:6:013:2 0:2 10 = 93a80203 04050607 0809
ffff8800a2139840 4106209477 S Ii:6:013:2 -115:2 10 <
ffff8800a2139840 4106214418 C Ii:6:013:2 0:2 10 = 93a90203 04050607 0809
ffff8800a2139840 4106215007 S Ii:6:013:2 -115:2 10 <
ffff8800a2139840 4106220433 C Ii:6:013:2 0:2 10 = 93aa0203 04050607 0809
ffff8800a2139840 4106220518 S Ii:6:013:2 -115:2 10 <
ffff8800a2139840 4106224418 C Ii:6:013:2 0:2 10 = 93ab0203 04050607 0809
ffff8800a2139840 4106224969 S Ii:6:013:2 -115:2 10 <
ffff8800a2139840 4106230417 C Ii:6:013:2 0:2 10 = 93ac0203 04050607 0809
ffff8800a2139840 4106230475 S Ii:6:013:2 -115:2 10 <
ffff8800a2139840 4106236619 C Ii:6:013:2 0:2 10 = 93ad0203 04050607 0809
ffff8800a2139840 4106237410 S Ii:6:013:2 -115:2 10 <
ffff8800a2139840 4106240616 C Ii:6:013:2 0:2 10 = 93ae0203 04050607 0809
ffff8800a2139840 4106240968 S Ii:6:013:2 -115:2 10 <
ffff8800a2139840 4106246613 C Ii:6:013:2 0:2 10 = 93af0203 04050607 0809
ffff8800a2139840 4106246962 S Ii:6:013:2 -115:2 10 <
ffff8800a2139840 4106252614 C Ii:6:013:2 0:2 10 = 93b00203 04050607 0809
ffff8800a2139840 4106253507 S Ii:6:013:2 -115:2 10 <
ffff8800a2139840 4106258425 C Ii:6:013:2 0:2 10 = 93b10203 04050607 0809
ffff8800a2139840 4106259459 S Ii:6:013:2 -115:2 10 <
ffff8800a2139840 4106261434 C Ii:6:013:2 0:2 10 = 93b20203 04050607 0809
ffff8800a2139840 4106261679 S Ii:6:013:2 -115:2 10 <
ffff8800a2139840 4106268432 C Ii:6:013:2 0:2 10 = 93b30203 04050607 0809
ffff8800a2139840 4106269351 S Ii:6:013:2 -115:2 10 <
ffff8800a2139840 4106274434 C Ii:6:013:2 0:2 10 = 93b40203 04050607 0809
ffff8800a2139840 4106274828 S Ii:6:013:2 -115:2 10 <
ffff8800a2139840 4106280433 C Ii:6:013:2 0:2 10 = 93b50203 04050607 0809
ffff8800a2139840 4106281432 S Ii:6:013:2 -115:2 10 <
ffff8800a2139840 4106283432 C Ii:6:013:2 0:2 10 = 93b60203 04050607 0809
ffff8800a2139840 4106283606 S Ii:6:013:2 -115:2 10 <
ffff8800a2139840 4106290432 C Ii:6:013:2 0:2 10 = 93b70203 04050607 0809
ffff8800a2139840 4106291279 S Ii:6:013:2 -115:2 10 <
ffff8800a2139840 4106296417 C Ii:6:013:2 0:2 10 = 93b80203 04050607 0809
ffff8800a2139840 4106296795 S Ii:6:013:2 -115:2 10 <
ffff8800a2139840 4106299433 C Ii:6:013:2 0:2 10 = 93b90203 04050607 0809
ffff8800a2139840 4106300079 S Ii:6:013:2 -115:2 10 <
ffff8800a2139840 4106306417 C Ii:6:013:2 0:2 10 = 93ba0203 04050607 0809
ffff8800a2139840 4106306681 S Ii:6:013:2 -115:2 10 <
ffff8800a2139840 4106312433 C Ii:6:013:2 0:2 10 = 93bb0203 04050607 0809
ffff8800a2139840 4106313272 S Ii:6:013:2 -115:2 10 <
ffff8800a2139840 4106318417 C Ii:6:013:2 0:2 10 = 93bc0203 04050607 0809
ffff8800a2139840 4106318783 S Ii:6:013:2 -115:2 10 <
ffff8800a2139840 4106321435 C Ii:6:013:2 0:2 10 = 93bd0203 04050607 0809
ffff8800a2139840 4106322065 S Ii:6:013:2 -115:2 10 <
ffff8800a2139840 4106328417 C Ii:6:013:2 0:2 10 = 93be0203 04050607 0809
ffff8800a2139840 4106328666 S Ii:6:013:2 -115:2 10 <
ffff8800a2139840 4106334434 C Ii:6:013:2 0:2 10 = 93bf0203 04050607 0809
ffff8800a2139840 4106335190 S Ii:6:013:2 -115:2 10 <
ffff8800a2139840 4106340432 C Ii:6:013:2 0:2 10 = 93c00203 04050607 0809
ffff8800a2139840 4106340717 S Ii:6:013:2 -115:2 10 <
ffff8800a2139840 4106344442 C Ii:6:013:2 0:2 10 = 93c10203 04050607 0809
ffff8800a2139840 4106345151 S Ii:6:013:2 -115:2 10 <
ffff8800a2139840 4106350433 C Ii:6:013:2 0:2 10 = 93c20203 04050607 0809
ffff8800a2139840 4106350667 S Ii:6:013:2 -115:2 10 <
ffff8800a2139840 4106356432 C Ii:6:013:2 0:2 10 = 93c30203 04050607 0809
ffff8800a2139840 4106357230 S Ii:6:013:2 -115:2 10 <
ffff8800a2139840 4106362432 C Ii:6:013:2 0:2 10 = 93c40203 04050607 0809
ffff8800a2139840 4106362692 S Ii:6:013:2 -115:2 10 <
ffff8800a2139840 4106366416 C Ii:6:013:2 0:2 10 = 93c50203 04050607 0809
ffff8800a2139840 4106367140 S Ii:6:013:2 -115:2 10 <
ffff8800a2139840 4106372417 C Ii:6:013:2 0:2 10 = 93c60203 04050607 0809
ffff8800a2139840 4106372642 S Ii:6:013:2 -115:2 10 <
ffff8800a2139840 4106378417 C Ii:6:013:2 0:2 10 = 93c70203 04050607 0809
ffff8800a2139840 4106379243 S Ii:6:013:2 -115:2 10 <
ffff8800a2139840 4106381435 C Ii:6:013:2 0:2 10 = 93c80203 04050607 0809
ffff8800a2139840 4106381730 S Ii:6:013:2 -115:2 10 <
ffff8800a2139840 4106388417 C Ii:6:013:2 0:2 10 = 93c90203 04050607 0809
ffff8800a2139840 4106389428 S Ii:6:013:2 -115:2 10 <
ffff8800a2139840 4106394420 C Ii:6:013:2 0:2 10 = 93ca0203 04050607 0809
ffff8800a2139840 4106395111 S Ii:6:013:2 -115:2 10 <
ffff8800a2139840 4106400417 C Ii:6:013:2 0:2 10 = 93cb0203 04050607 0809
ffff8800a2139840 4106400654 S Ii:6:013:2 -115:2 10 <
ffff8800a2139840 4106403434 C Ii:6:013:2 0:2 10 = 93cc0203 04050607 0809
ffff8800a2139840 4106403983 S Ii:6:013:2 -115:2 10 <
ffff8800a2139840 4106410431 C Ii:6:013:2 0:2 10 = 93cd0203 04050607 0809
ffff8800a2139840 4106410501 S Ii:6:013:2 -115:2 10 <
ffff8800a2139840 4106416440 C Ii:6:013:2 0:2 10 = 93ce0203 04050607 0809
ffff8800a2139840 4106416568 S Ii:6:013:2 -115:2 10 <
ffff8800a2139840 4106422618 C Ii:6:013:2 0:2 10 = 93cf0203 04050607 0809
ffff8800a2139840 4106422844 S Ii:6:013:2 -115:2 10 <
ffff8800a2139840 4106425447 C Ii:6:013:2 0:2 10 = 93d00203 04050607 0809
ffff8800a2139840 4106425560 S Ii:6:013:2 -115:2 10 <
ffff8800a2139840 4106432441 C Ii:6:013:2 0:2 10 = 93d10203 04050607 0809
ffff8800a2139840 4106433000 S Ii:6:013:2 -115:2 10 <
ffff8800a2139840 4106438616 C Ii:6:013:2 0:2 10 = 93d20203 04050607 0809
ffff8800a2139840 4106439333 S Ii:6:013:2 -115:2 10 <
ffff8800a2139840 4106441620 C Ii:6:013:2 0:2 10 = 93d30203 04050607 0809
ffff8800a2139840 4106441763 S Ii:6:013:2 -115:2 10 <
ffff8800a2139840 4106448615 C Ii:6:013:2 0:2 10 = 93d40203 04050607 0809
ffff8800a2139840 4106449579 S Ii:6:013:2 -115:2 10 <
ffff8800a2139840 4106454442 C Ii:6:013:2 0:2 10 = 93d50203 04050607 0809
ffff8800a2139840 4106454486 S Ii:6:013:2 -115:2 10 <
ffff8800a2139840 4106460438 C Ii:6:013:2 0:2 10 = 93d60203 04050607 0809
ffff8800a2139840 4106461293 S Ii:6:013:2 -115:2 10 <
ffff8800a2139840 4106463433 C Ii:6:013:2 0:2 10 = 93d70203 04050607 0809
ffff8800a2139840 4106463498 S Ii:6:013:2 -115:2 10 <
ffff8800a2139840 4106470433 C Ii:6:013:2 0:2 10 = 93d80203 04050607 0809
ffff8800a2139840 4106471168 S Ii:6:013:2 -115:2 10 <
ffff8800a2139840 4106476433 C Ii:6:013:2 0:2 10 = 93d90203 04050607 0809
ffff8800a2139840 4106476684 S Ii:6:013:2 -115:2 10 <
ffff8800a2139840 4106482434 C Ii:6:013:2 0:2 10 = 93da0203 04050607 0809
ffff8800a2139840 4106483277 S Ii:6:013:2 -115:2 10 <
ffff8800a2139840 4106486417 C Ii:6:013:2 0:2 10 = 93db0203 04050607 0809
ffff8800a2139840 4106486606 S Ii:6:013:2 -115:2 10 <
ffff8800a2139840 4106492620 C Ii:6:013:2 0:2 10 = 93dc0203 04050607 0809
ffff8800a2139840 4106492667 S Ii:6:013:2 -115:2 10 <
ffff8800a2139840 4106498615 C Ii:6:013:2 0:2 10 = 93dd0203 04050607 0809
ffff8800a2139840 4106498893 S Ii:6:013:2 -115:2 10 <
ffff8800a2139840 4106501464 C Ii:6:013:2 0:2 10 = 93de0203 04050607 0809
ffff8800a2139840 4106501515 S Ii:6:013:2 -115:2 10 <
ffff8800a2139840 4106508422 C Ii:6:013:2 0:2 10 = 93df0203 04050607 0809
ffff8800a2139840 4106508529 S Ii:6:013:2 -115:2 10 <
ffff8800a2139840 4106514420 C Ii:6:013:2 0:2 10 = 93e00203 04050607 0809
ffff8800a2139840 4106515120 S Ii:6:013:2 -115:2 10 <
ffff8800a2139840 4106520417 C Ii:6:013:2 0:2 10 = 93e10203 04050607 0809
ffff8800a2139840 4106520687 S Ii:6:013:2 -115:2 10 <
ffff8800a2139840 4106524418 C Ii:6:013:2 0:2 10 = 93e20203 04050607 0809
ffff8800a2139840 4106525093 S Ii:6:013:2 -115:2 10 <
ffff8800a2139840 4106530415 C Ii:6:013:2 0:2 10 = 93e30203 04050607 0809
ffff8800a2139840 4106530644 S Ii:6:013:2 -115:2 10 <
ffff8800a2139840 4106536417 C Ii:6:013:2 0:2 10 = 93e40203 04050607 0809
ffff8800a2139840 4106537229 S Ii:6:013:2 -115:2 10 <
ffff8800a2139840 4106542416 C Ii:6:013:2 0:2 10 = 93e50203 04050607 0809
ffff8800a2139840 4106542720 S Ii:6:013:2 -115:2 10 <
ffff8800a2139840 4106546416 C Ii:6:013:2 0:2 10 = 93e60203 04050607 0809
ffff8800a2139840 4106547118 S Ii:6:013:2 -115:2 10 <
ffff8800a2139840 4106552416 C Ii:6:013:2 0:2 10 = 93e70203 04050607 0809
ffff8800a2139840 4106552606 S Ii:6:013:2 -115:2 10 <
ffff8800a2139840 4106558418 C Ii:6:013:2 0:2 10 = 93e80203 04050607 0809
ffff8800a2139840 4106559156 S Ii:6:013:2 -115:2 10 <
ffff8800a2139840 4106564435 C Ii:6:013:2 0:2 10 = 93e90203 04050607 0809
ffff8800a2139840 4106564639 S Ii:6:013:2 -115:2 10 <
ffff8800a2139840 4106568417 C Ii:6:013:2 0:2 10 = 93ea0203 04050607 0809
ffff8800a2139840 4106569087 S Ii:6:013:2 -115:2 10 <
ffff8800a2139840 4106574418 C Ii:6:013:2 0:2 10 = 93eb0203 04050607 0809
ffff8800a2139840 4106574585 S Ii:6:013:2 -115:2 10 <
ffff8800a2139840 4106580417 C Ii:6:013:2 0:2 10 = 93ec0203 04050607 0809
ffff8800a2139840 4106581168 S Ii:6:013:2 -115:2 10 <
ffff8800a2139840 4106583432 C Ii:6:013:2 0:2 10 = 93ed0203 04050607 0809
ffff8800a2139840 4106584428 S Ii:6:013:2 -115:2 10 <
ffff8800a2139840 4106590416 C Ii:6:013:2 0:2 10 = 93ee0203 04050607 0809
ffff8800a2139840 4106591062 S Ii:6:013:2 -115:2 10 <
ffff8800a2139840 4106596417 C Ii:6:013:2 0:2 10 = 93ef0203 04050607 0809
ffff8800a2139840 4106596644 S Ii:6:013:2 -115:2 10 <
ffff8800a2139840 4106602432 C Ii:6:013:2 0:2 10 = 93f00203 04050607 0809
ffff8800a2139840 4106603218 S Ii:6:013:2 -115:2 10 <
ffff8800a2139840 4106606433 C Ii:6:013:2 0:2 10 = 93f10203 04050607 0809
ffff8800a2139840 4106606531 S Ii:6:013:2 -115:2 10 <
ffff8800a2139840 4106612416 C Ii:6:013:2 0:2 10 = 93f20203 04050607 0809
ffff8800a2139840 4106613097 S Ii:6:013:2 -115:2 10 <
ffff8800a2139840 4106618418 C Ii:6:013:2 0:2 10 = 93f30203 04050607 0809
ffff8800a2139840 4106618591 S Ii:6:013:2 -115:2 10 <
ffff8800a2139840 4106624435 C Ii:6:013:2 0:2 10 = 93f40203 04050607 0809
ffff8800a2139840 4106625192 S Ii:6:013:2 -115:2 10 <
ffff8800a2139840 4106627433 C Ii:6:013:2 0:2 10 = 93f50203 04050607 0809
ffff8800a2139840 4106628457 S Ii:6:013:2 -115:2 10 <
ffff8800a2139840 4106634434 C Ii:6:013:2 0:2 10 = 93f60203 04050607 0809
ffff8800a2139840 4106635009 S Ii:6:013:2 -115:2 10 <
ffff8800a2139840 4106640417 C Ii:6:013:2 0:2 10 = 93f70203 04050607 0809
ffff8800a2139840 4106640473 S Ii:6:013:2 -115:2 10 <
ffff8800a2139840 4106643432 C Ii:6:013:2 0:2 10 = 93f80203 04050607 0809
ffff8800a2139840 4106643757 S Ii:6:013:2 -115:2 10 <
ffff8800a2139840 4106650417 C Ii:6:013:2 0:2 10 = 93f90203 04050607 0809
ffff8800a2139840 4106651468 S Ii:6:013:2 -115:2 10 <
ffff8800a2139840 4106656416 C Ii:6:013:2 0:2 10 = 93fa0203 04050607 0809
ffff8800a2139840 4106657001 S Ii:6:013:2 -115:2 10 <
ffff8800a2139840 4106662417 C Ii:6:013:2 0:2 10 = 93fb0203 04050607 0809
ffff8800a2139840 4106662474 S Ii:6:013:2 -115:2 10 <
ffff8800a2139840 4106665433 C Ii:6:013:2 0:2 10 = 93fc0203 04050607 0809
ffff8800a2139840 4106665755 S Ii:6:013:2 -115:2 10 <
ffff8800a2139840 4106672433 C Ii:6:013:2 0:2 10 = 93fd0203 04050607 0809
ffff8800a2139840 4106673423 S Ii:6:013:2 -115:2 10 <
ffff8800a2139840 4106678433 C Ii:6:013:2 0:2 10 = 93fe0203 04050607 0809
ffff8800a2139840 4106678909 S Ii:6:013:2 -115:2 10 <
ffff8800a2139840 4106684434 C Ii:6:013:2 0:2 10 = 93ff0203 04050607 0809
ffff8800a2139840 4106685478 S Ii:6:013:2 -115:2 10 <
ffff8800a2139840 4106687432 C Ii:6:013:2 0:2 10 = 93000203 04050607 0809
ffff8800a2139840 4106687675 S Ii:6:013:2 -115:2 10 <
ffff8800a2139840 4106694434 C Ii:6:013:2 0:2 10 = 93010203 04050607 0809
ffff8800a2139840 4106695338 S Ii:6:013:2 -115:2 10 <
ffff8800a2139840 4106700432 C Ii:6:013:2 0:2 10 = 93020203 04050607 0809
ffff8800a2139840 4106700863 S Ii:6:013:2 -115:2 10 <
ffff8800a2139840 4106706415 C Ii:6:013:2 0:2 10 = 93030203 04050607 0809
ffff8800a2139840 4106707464 S Ii:6:013:2 -115:2 10 <
ffff8800a2139840 4106709433 C Ii:6:013:2 0:2 10 = 93040203 04050607 0809
ffff8800a2139840 4106709691 S Ii:6:013:2 -115:2 10 <
ffff8800a2139840 4106716417 C Ii:6:013:2 0:2 10 = 93050203 04050607 0809
ffff8800a2139840 4106717379 S Ii:6:013:2 -115:2 10 <
ffff8800a2139840 4106722417 C Ii:6:013:2 0:2 10 = 93060203 04050607 0809
ffff8800a2139840 4106722913 S Ii:6:013:2 -115:2 10 <
ffff8800a2139840 4106725433 C Ii:6:013:2 0:2 10 = 93070203 04050607 0809
ffff8800a2139840 4106726196 S Ii:6:013:2 -115:2 10 <
ffff8800a2139840 4106732434 C Ii:6:013:2 0:2 10 = 93080203 04050607 0809
ffff8800a2139840 4106732780 S Ii:6:013:2 -115:2 10 <
ffff8800a2139840 4106737799 C Ii:6:013:2 0:2 10 = 93090203 04050607 0809
ffff8800a2139840 4106738423 S Ii:6:013:2 -115:2 10 <
ffff8800a2139840 4106744618 C Ii:6:013:2 0:2 10 = 930a0203 04050607 0809
ffff8800a2139840 4106744701 S Ii:6:013:2 -115:2 10 <
ffff8800a2139840 4106747444 C Ii:6:013:2 0:2 10 = 930b0203 04050607 0809
ffff8800a2139840 4106747497 S Ii:6:013:2 -115:2 10 <
ffff8800a2139840 4106754620 C Ii:6:013:2 0:2 10 = 930c0203 04050607 0809
ffff8800a2139840 4106754936 S Ii:6:013:2 -115:2 10 <
ffff8800a2139840 4106760438 C Ii:6:013:2 0:2 10 = 930d0203 04050607 0809
ffff8800a2139840 4106760726 S Ii:6:013:2 -115:2 10 <
ffff8800a2139840 4106766432 C Ii:6:013:2 0:2 10 = 930e0203 04050607 0809
ffff8800a2139840 4106767308 S Ii:6:013:2 -115:2 10 <
ffff8800a2139840 4106769432 C Ii:6:013:2 0:2 10 = 930f0203 04050607 0809
ffff8800a2139840 4106769537 S Ii:6:013:2 -115:2 10 <
ffff8800a2139840 4106776432 C Ii:6:013:2 0:2 10 = 93100203 04050607 0809
ffff8800a2139840 4106777204 S Ii:6:013:2 -115:2 10 <
ffff8800a2139840 4106782433 C Ii:6:013:2 0:2 10 = 93110203 04050607 0809
ffff8800a2139840 4106782679 S Ii:6:013:2 -115:2 10 <
ffff8800a2139840 4106785433 C Ii:6:013:2 0:2 10 = 93120203 04050607 0809
ffff8800a2139840 4106785967 S Ii:6:013:2 -115:2 10 <
ffff8800a2139840 4106792419 C Ii:6:013:2 0:2 10 = 93130203 04050607 0809
ffff8800a2139840 4106792804 S Ii:6:013:2 -115:2 10 <
ffff8800a2139840 4106798417 C Ii:6:013:2 0:2 10 = 93140203 04050607 0809
ffff8800a2139840 4106799414 S Ii:6:013:2 -115:2 10 <
ffff8800a2139840 4106804441 C Ii:6:013:2 0:2 10 = 93150203 04050607 0809
